publication_id,tool,quote,best_match_source,best_match,similarity
655,PRECIS-2,"After the randomization visit, follow-up appointments were arranged for both groups at 3, 9 and 12 months. At each follow-up visit, the general health status of the patient was assessed, medical treatment was revised and optimized, educational reinforcement was provided, 6-minute walk test (6MWT) and spirometry tests were carried out and HRQoL measures were taken.",fulltext,"After the randomization visit, follow-up appointments were arranged for both groups at 3, 9 and 12 months. At each follow-up visit, the general health status of the patient was assessed, medical treatment was revised and optimized, educational reinforcement was provided, 6-minute walk test (6MWT) and spirometry tests were carried out and HRQoL measures were taken.",100.0
655,PRECIS-2,Exercise tolerance (the ability to sustain exercise) was assessed using distance covered in the 6MWT.,fulltext,Exercise tolerance (the ability to sustain exercise) was assessed using distance covered in the 6MWT.,100.0
655,PRECIS-2,"Patient selection criteria were having a diagnosis of moderate-to-severe COPD (a Body mass index, Airflow obstruction, dyspnoea and Exercise capacity [BODE] index score of 3–7) according to international guidelines",fulltext,"Patient selection criteria were having a diagnosis of moderate-to-severe COPD (a Body mass index, Airflow obstruction, dyspnoea and Exercise capacity [BODE] index score of 3–7) according to international guidelines",100.0
655,PRECIS-2,"The main efficacy analysis used analysis of covariance (ANCOVA) techniques to test for differences between groups in outcome variables at the 12-month visit, adjusted for baseline values.",fulltext,"The main efficacy analysis used analysis of covariance (ANCOVA) techniques to test for differences between groups in outcome variables at the 12-month visit, adjusted for baseline values.",100.0
655,PRECIS-2,The hospital-based outpatient programme consisted of three training sessions a week which included 30 min of weight lifting and 30 min of leg cycle ergometry along with four educational sessions which included chest physiotherapy training.,fulltext,The hospital-based outpatient programme consisted of three training sessions a week which included 30 min of weight lifting J.B. Galdiz et al. / Arch Bronconeumol. 2021;57(3):195–204 197 and 30 min of leg cycle ergometry along with four educational sessions which included chest physiotherapy training ,100.0
655,PRECIS-2,"Patients in the IG were asked to continue at home with a similar training schedule to that completed in the hospital. They were provided with, for the 12-month follow-up period, a telerehabilitation kit (mobile phone, pulse oximeter, dumbbells and exercise bicycle) along with a user guide with detailed instructions on the use of the mobile device to deliver data collected to the web-based platform after completion of each scheduled session.",fulltext,"Patients in the IG were asked to continue at home with a similar training schedule to that completed in the hospital. They were provided with, for the 12-month follow-up period, a telerehabilitation kit (mobile phone, pulse oximeter, dumbbells and exercise bicycle) along with a user guide with detailed instructions on the use of the mobile device to deliver data collected to the web-based platform after completion of each scheduled session ",100.0
655,PRECIS-2,"A patient in the IG arm was classified as a non-complier if he/she did not perform scheduled exercises for at least 8 consecutive weeks, unless there were clear clinical reasons not to.",fulltext," patient in the IG arm was classified as a non-complier if he/she did not perform scheduled exercises for at least 8 consecutive weeks, unless there were clear clinical reasons not to.",99.45945945945947
655,PRECIS-2,"Patients in the CG received usual care, that is, they were advised to exercise regularly (at least walking for 1 hour a day) and provided with general educational material, following current clinical practice at participating sites.",fulltext,"Patients in the CG received usual care, that is, they were advised to exercise regularly (at least walking for 1 hour a day) and provided with general educational material, following current clinical practice at participating sites.",100.0
657,PRECIS-2,Assessments at all time points took place at a Norwegian hospital.,fulltext,Assessments at all time points took place at a Norwegian hospital.,100.0
657,PRECIS-2,"Enrollment started in September 2015, and follow-up was completed in September 2016.",fulltext,"Enrollment started in September 2015, and follow-up was completed in September 2016.",100.0
657,PRECIS-2,"Assessments were undertaken at baseline and at weeks 7, 18, and 30.",fulltext,"Assessments were undertaken at baseline and at weeks 7, 18, and 30.",100.0
657,PRECIS-2,"The control group continued their regular routine and were encouraged to maintain their current level of physical activity and to seek any health care required, including physical therapy.",fulltext,"The control group continued their regular routine and were encouraged to maintain their current level of physical activity and to seek any health care required, including physical therapy.",100.0
657,PRECIS-2,"Outcomes were measured with the Trunk Impairment Scale–Norwegian Version, Mini Balance Evaluation Systems Test, and Patient Global Impression of Change–Balance.",fulltext,"Outcomes were measured with the Trunk Impairment Scale–Norwegian Version, Mini Balance Evaluation Systems Test, and Patient Global Impression of Change–Balance.",100.0
657,PRECIS-2,"The exercises were performed barefoot in various postural sets, always keeping a focus on dynamic core stability, alignment throughout the body, and optimal movement performance.",fulltext,"The exercises were performed barefoot in various postural sets, always keeping a focus on dynamic core stability, alignment throughout the body, and optimal movement performance.",100.0
657,PRECIS-2,"One individual missed all postintervention tests, leaving 79 participants in the intention-to-treat analysis.",fulltext,"One individual missed all postintervention tests, leaving 79 participants in the intention-to-treat analysis.",100.0
657,PRECIS-2,Six neurological physical therapists conducted the intervention after being trained in GroupCoreDIST for 5 days.,fulltext,Six neurological physical therapists conducted the intervention after being trained in GroupCoreDIST for 5 days.,100.0
657,PRECIS-2,"The inclusion criteria were as follows: (1) diagnosed with MS in accordance with the McDonald criteria; (2) registered at the MS outpatient clinic; (3) living in 1 of 6 selected municipalities; (4) aged 18 years or older; (5) capable of providing signed written informed consent; and (6) EDSS score between 1 and 6.5 (1 = minor disability, 6.5 = able to walk 20 m with or without a walking aid).",fulltext,"The inclusion criteria were as follows: (1) diagnosed with MS in accordance with the McDonald criteria 27 ; (2) registered at the MS outpatient clinic; (3) living in 1 of 6 selected municipalities; (4) aged 18 years or older; (5) capable of providing signed written informed consent; and (6) EDSS score between 1 and 6.5 (1 = minor disability, 6.5 = able to walk 20 m with or without a walking aid).",100.0
657,PRECIS-2,"Ninety-three persons returned signed written informed consent. Among the 67 persons who did not respond, 57% had EDSS scores of 0 to 3.5, 21% had EDSS scores of 4 to 7, and 22% had an unknown EDSS score.",fulltext,"Ninety-three persons returned signed written informed consent. Among the 67 persons who did not respond, 57% had EDSS scores of 0 to 3.5, 21% had EDSS scores of 4 to 7, and 22% had an 1",90.64039408866995
657,PRECIS-2,"The physical therapists individualized the exercises by tailoring them according to each individual’s symptoms, disability level, and general well-being, and they intensified the exercises by increasing number of repetitions, level of difficulty, and/or by adding motor-cognitive dual tasks as movement quality improved.",fulltext,"The physical therapists individualized the exercises by tailoring them according to each individual’s symptoms, disability level, and general well-being, and they intensified the exercises by increasing number of repetitions, level of difficulty, and/or by adding motor-cognitive dual tasks as movement quality improved.",100.0
657,PRECIS-2,Participants in the intervention group were encouraged not to seek any physical therapy other than GroupCoreDIST during the 6 weeks of the intervention.,fulltext,Participants in the intervention group were encouraged not to seek any physical therapy other than GroupCoreDIST during the 6 weeks of the intervention.,100.0
657,PRECIS-2,Two assessors masked with regard to the group allocation carried out the assessments.,fulltext,Two assessors masked with regard to the group allocation carried out the assessments.,100.0
657,PRECIS-2,Repeated-measures mixed models were used for statistical analysis.,fulltext,Repeated-measures mixed models were used for statistical analysis.,100.0
657,PRECIS-2,"The TIS-NV measures dynamic sitting balance and trunk control and includes 6 test items scored from 0 to 2 or 3, with a total score from 0 to 16 (0 = severe problem).",fulltext,"The TIS-NV measures dynamic sitting balance and trunk control and includes 6 test items scored from 0 to 2 or 3, with a total score from 0 to 16 (0 = severe problem).",100.0
657,PRECIS-2,The GroupCoreDIST intervention was conducted by 6 physical therapists in 6 municipalities in Norway.,fulltext,The GroupCoreDIST intervention was conducted by 6 physical therapists in 6 municipalities in Norway.,100.0
657,PRECIS-2,"The physical therapists received a booklet with descriptions and photos of all exercises and variations, as well as the theoretical framework for the intervention.",fulltext,"The physical therapists received a booklet with descriptions and photos of all exercises and variations, as well as the theoretical framework for the intervention.",100.0
657,PRECIS-2,Eighty people with Expanded Disability Status scores of 1 to 6.5 participated in this trial.,fulltext,Eighty people with Expanded Disability Status scores of 1 to 6.5 participated in this trial.,100.0
662,PRECIS-2,We recruited potential participants through adverts on the MS Society website and from National Health Service (NHS) MS centres across the UK.,fulltext,We recruited potential participants through adverts on the MS Society website and from National Health Service (NHS) MS centres across the UK.,100.0
662,PRECIS-2,"Participants were encouraged to keep a diary of home practice, but, in fact, very few did record it.",fulltext,"Participants were encouraged to keep a diary of home practice, but, in fact, very few did record it.",100.0
662,PRECIS-2,The GHQ is designed to measure general levels of distress. The GHQ is uncontaminated by the experience of MS-related somatic symptoms and is the most treatment-responsive measure of psychological distress in MS.,fulltext,The GHQ 17 is designed to measure general levels of distress. The GHQ is uncontaminated by the experience of MS-related somatic symptoms and is the most treatment-responsive measure of psychological distress in MS.,100.0
662,PRECIS-2,We delivered the programme in eight hour-long sessions over an eight-week period via Skype video conferences.,fulltext,We delivered the programme in eight hour-long sessions over an eight-week period via Skype video conferences.,100.0
662,PRECIS-2,"Participants completed online questionnaires at baseline (prior to randomisation), post-intervention and three-month follow-up.",fulltext,"Participants completed online questionnaires at baseline (prior to randomisation), post-intervention and three-month follow-up.",100.0
662,PRECIS-2,"Inclusion criteria were diagnosis of PPMS or SPMS, Internet access and some level of distress determined by a score of 3 or greater on the General Health Questionnaire (GHQ-12).",fulltext,"Inclusion criteria were diagnosis of PPMS or SPMS, Internet access and some level of distress determined by a score of 3 or greater on the General Health Questionnaire (GHQ-12).",100.0
662,PRECIS-2,We conducted all group comparisons on an intention-to-treat basis where we analysed participants in the group to which they were randomised.,fulltext,We conducted all group comparisons on an intention-to-treat basis where we analysed participants in the group to which they were randomised.,100.0
662,PRECIS-2,"The format and manual for the mindfulness group, including length of sessions and individual mindfulness practices, were developed in partnership with patients with MS through initial experimental case studies.",fulltext,"The format and manual for the mindfulness group, including length of sessions and individual mindfulness practices, were developed in partnership with patients with MS through initial experimental case studies.",100.0
662,PRECIS-2,"AB, a health psychologist, facilitated the courses. AB was supervised by PC, a clinical psychologist and expert mindfulness practitioner.",fulltext,"AB, a health psychologist, facilitated the courses. AB was supervised by PC, a clinical psychologist and expert mindfulness practitioner.",100.0
663,PRECIS-2,The follow-up test was performed within 7 days of the last intervention session or after the last day of being on the waitlist.,fulltext,The follow-up test was performed within 7 days of the last intervention session or after the last day of being on the waitlist.,100.0
663,PRECIS-2,"The exercises were conducted in machines that targeted the specified muscle groups, but type of machines could vary between centers.",fulltext,"The exercises were conducted in machines that targeted the specified muscle groups, but type of machines could vary between centers.",100.0
663,PRECIS-2,"Participants were included from September 2016 to October 2018, after being invited via seven MS clinics (specified in “Acknowledgements” section) and targeted advertisements sent out via the Danish MS Society.",fulltext,"Participants were included from September 2016 to October 2018, after being invited via seven MS clinics (specified in “Acknowledgements” section) and targeted advertisements sent out via the Danish MS Society.",100.0
663,PRECIS-2,The interventions lasted 10 weeks. A total of 71 participants with impaired mobility (Timed 25-Foot Walk (T25FW) > 5 seconds or Six Spot Step Test (SSST) > 8 seconds) were enrolled.,fulltext,The interventions lasted 10 weeks. A total of 71 participants with impaired mobility (Timed 25-Foot Walk (T25FW) > 5 seconds or Six Spot Step Test (SSST) > 8 seconds) were enrolled.,100.0
663,PRECIS-2,"Exercise intensity was derived from the rate of failure, as this was interpreted as an indication of how challenging a given task was perceived.",fulltext,"Exercise intensity was derived from the rate of failure, as this was interpreted as an indication of how challenging a given task was perceived.",100.0
663,PRECIS-2,All training sessions were supervised by physiotherapists who were trained to deliver the intervention.,fulltext,All training sessions were supervised by physiotherapists who were trained to deliver the intervention.,100.0
663,PRECIS-2,The primary outcomes were the T25FW and the SSST.,fulltext, Primary outcomes were the T25FW and the SSST.,93.87755102040816
663,PRECIS-2,"Analyses were carried out as intention-to-treat, where all participants who completed the baseline assessment were included regardless of their adherence to the allocated intervention.",fulltext,"Analyses were carried out as intention-to-treat, where all participants who completed the baseline assessment were included regardless of their adherence to the allocated intervention.",100.0
663,PRECIS-2,"The inclusion criteria were as follows: age > 18, confirmed diagnosis of MS, Expanded Disability Status Scale (EDSS): 2.0–6.5, Six Spot Step Test (SSST) score > 8 seconds or Timed 25-Foot Walk (T25FW) > 5 seconds, relapse-free within the past 8 weeks, and no adjustment of disease-modifying medication or medication that affects gait performance and spasticity within the past 8 weeks.",fulltext,"The inclusion criteria were as follows: age > 18, confirmed diagnosis of MS, Expanded Disability Status Scale (EDSS): 2.0–6.5, Six Spot Step Test (SSST) score > 8 seconds or Timed 25-Foot Walk (T25FW) > 5 seconds, relapse-free within the past 8 weeks, and no adjustment of disease-modifying medication or medication that affects gait performance and spasticity within the past 8 weeks.",100.0
664,PRECIS-2,"The inclusion criteria for the trial were clinical diagnosis of MS, as defined by the modified McDonald criteria, with an Expanded Disability Status Scale (EDSS) score of 1.0–6.5, and able to walk a 10-metre distance; aged 18–65 years; clinically stable for at least four weeks prior to entering the study; physically able to participate in exercise three times per week; able to provide written informed consent.",fulltext,"The inclusion criteria for the trial were clinical diagnosis of MS, as defined by the modified McDonald criteria, 9 with an Expanded Disability Status Scale (EDSS) score of 1.0–6.5, and able to walk a 10-metre distance; aged 18–65 years; clinically stable for at least four weeks prior to entering the study; physically able to participate in exercise three times per week; able to provide written informed consent.",100.0
664,PRECIS-2,"Participants were encouraged to seek out opportunities to exercise in the local community (e.g. healthy living centres, health walks, fitness centres, swimming pools, etc.), based on their individual preferences.",fulltext,"Participants were encouraged to seek out opportunities to exercise in the local community (e.g. healthy living centres, health walks, fitness centres, swimming pools, etc.), based on their individual preferences.",100.0
664,PRECIS-2,The primary outcome was self-reported exercise behaviour (Godin Leisure Time Exercise Questionnaire (GLTEQ)).,fulltext,The primary outcome was self-reported exercise behaviour (Godin Leisure Time Exercise Questionnaire (GLTEQ)).,100.0
664,PRECIS-2,"All analyses were by intention to treat, whereby participants were analysed in the arm to which they were randomised irrespective of whether they complied with the intervention.",fulltext,"All analyses were by intention to treat, whereby participants were analysed in the arm to which they were randomised irrespective of whether they complied with the intervention.",100.0
664,PRECIS-2,Outcomes were blindly assessed at baseline and at three and nine months after randomisation.,fulltext,Outcomes were blindly assessed at baseline and at three and nine months after randomisation.,100.0
664,PRECIS-2,"The programme was designed to be pragmatic and accessible, taking into account exercise preferences and giving choices.",fulltext,"The programme was designed to be pragmatic and accessible, taking into account exercise preferences and giving choices.",100.0
664,PRECIS-2,A total of 120 PwMS were recruited via the Sheffield MS Clinic and flyers/community adverts displayed at the local South Yorkshire MS Society branches.,fulltext,A total of 120 PwMS were recruited via the Sheffield MS Clinic and flyers/community adverts displayed at the local South Yorkshire MS Society branches.,100.0
664,PRECIS-2,An exercise physiologist supervised the delivery of the intervention but with physiotherapist input during the early stages of the programme.,fulltext,An exercise physiologist supervised the delivery of the intervention but with physiotherapist input during the early stages of the programme.,100.0
664,PRECIS-2,"During weeks 1–6, participants attended two supervised sessions per week at a university exercise research facility and engaged in one additional self-directed exercise session in their home environment.",fulltext,"During weeks 1–6, participants attended two supervised sessions per week at a university exercise research facility and engaged in one additional self-directed exercise session in their home environment.",100.0
665,PRECIS-2,Statistical analysis was mainly descriptive.,fulltext,Statistical analysis was mainly descriptive ,100.0
665,PRECIS-2,"Beating the Blues® consists of eight computer-interactive sessions, of approximately 50 minutes each in duration, designed to be taken weekly.",fulltext,"Beating the Blues ® consists of eight computer-interactive sessions, of approximately 50 minutes each in duration, designed to be taken weekly.",100.0
665,PRECIS-2,Our initial aim was to recruit 24 participants between 22 October 2008 and 31 January 2009 (101 days; 7.1 participants/month) with candidates identified by three neurologists working in a single weekly specialist MS clinic (Sheffield Teaching Hospitals NHS Trust).,fulltext,Our initial aim was to recruit 24 participants between 22 October 2008 and 31 January 2009 (101 days; 7.1 participants/month) with candidates identified by three neurologists working in a single weekly specialist MS clinic (Sheffield Teaching Hospitals NHS Trust).,100.0
665,PRECIS-2,The MS services in both sites are specific entities and not general neurology clinics.,fulltext,The MS services in both sites are specific entities and not general neurology clinics.,100.0
665,PRECIS-2,Primary outcome assessments were available for 21 (88%) participants at 8 weeks from randomisation (or end of treatment if later) and 18 (75%) participants at a further three months’ follow-up.,fulltext,primary outcome assessments were available for 21 (88%) participants at 8 weeks from randomisation (or end of treatment if later) and 18 (75%) participants at a further three months’ follow-up.,100.0
665,PRECIS-2,"Inclusion criteria were: age of 18 years or above; BDI score of at least 14 on two consecutive occasions and no treatment from psychologist, psychotherapist or psychiatrist within the last three months.",fulltext,"Inclusion criteria were: age of 18 years or above; BDI score of at least 14 on two consecutive occasions and no treatment from psychologist, psychotherapist or psychiatrist within the last three months.",100.0
665,PRECIS-2,"Of the 12 patients in the CCBT arm, 9 (75%) completed at least four, and 6 completed all 8 CCBT sessions.",fulltext,"Of the 12 patients in the CCBT arm, 9 (75%) completed at least four, and 6 completed all 8 CCBT sessions.",100.0
665,PRECIS-2,The study statisticians and principal investigator remained blinded to the treatment allocation codes until after the final analysis.,fulltext,The study statisticians and principal investigator remained blinded to the treatment allocation codes until after the final analysis.,100.0
665,PRECIS-2,The primary clinical endpoint was the mean change in self-reported symptoms of depression as measured on the BDI.,fulltext,The primary clinical endpoint was the mean change in self-reported symptoms of depression as measured on the BDI.,100.0
666,PRECIS-2,"Patients also participated in self-reported, daily at-home MSQ assessments on Days 1 through 7 after the baseline visit.",fulltext,"Patients also participated in self-reported, daily athome MSQ assessments on Days 1 through 7 after the baseline visit.",99.16666666666667
666,PRECIS-2,"The intention-to-treat (ITT) analysis set included all randomly assigned participants and were analyzed according to the treatment group to which they were randomly assigned, regardless of which treatment they actually received.",fulltext,"The intention-to-treat (ITT) analysis set included all randomly assigned participants and were analyzed according to the treatment group to which they were randomly assigned, regardless of which treatment they actually received.",100.0
666,PRECIS-2,Patients were recruited from 88 study centers in 14 countries.,fulltext,cted at 88 study centers in 14 countries ,62.903225806451616
666,PRECIS-2,The primary endpoint was patient-reported medication satisfaction using the Medication Satisfaction Questionnaire (MSQ).,fulltext,The primary endpoint was patient-reported medication satisfaction using the Medication Satisfaction Questionnaire (MSQ).,100.0
666,PRECIS-2,"Patients in the study received treatment for 6 months, and the study was conducted during a period starting in August 2015 and ending in January 2017.",fulltext,"Patients in the study received treatment for 6 months, and the study was conducted during a period starting in August 2015 and ending in January 2017.",100.0
666,PRECIS-2,Patients were randomly assigned 1:1 to receive subcutaneous injections of GA40 (n = 431) or GA20 (n = 430).,fulltext,Patients were randomly assigned 1:1 to receive subcutaneous injections of GA40 (n = 431) or GA20 (n = 430).,100.0
666,PRECIS-2,Treatment adherence was measured by Multiple Sclerosis Treatment Adherence Questionnaire.,fulltext,Treatment adherence was measured by Multiple Sclerosis Treatment Adherence Questionnaire.,100.0
666,PRECIS-2,"The CONFIDENCE study was a multinational, multicenter, randomized, parallel-group, phase 4, open-label study conducted at 88 study centers in 14 countries.",fulltext,"The CONFIDENCE study was a multinational, multicenter, randomized, parallel-group, phase 4, open-label study conducted at 88 study centers in 14 countries ",100.0
666,PRECIS-2,Patients (N = 861) were randomly assigned 1:1 to receive GA20 (n = 430) or GA40 (n = 431) during the core phase.,fulltext,Patients (N = 861) were randomly assigned 1:1 to receive GA20 (n = 430) or GA40 (n = 431) during the core phase.,100.0
668,PRECIS-2,"The experimental group completed a 10-week (two times per week), PRT program in one of four community gymnasiums in metropolitan and regional areas.",fulltext,"The experimental group completed a 10-week (two times per week), PRT program in one of four community gymnasiums in metropolitan and regional areas.",100.0
