publication_id,tool,quote,best_match_source,best_match,similarity
674,PRECIS-2,"CARE-MS II was a 2-year, randomized, rater-blinded, active comparator-controlled, head-to-head, trial of alemtuzumab (Lemtrada; Sanofi Genzyme, Cambridge, MA; 12 mg/day on 5 consecutive days at month 0 and on 3 consecutive days at month 12) vs SC IFN-b-1a (Rebif; EMD Serono, Rockland, MA; 44 mg 3 times weekly) in patients with RRMS with inadequate response to prior DMTs ($1 relapse during IFN-b or glatiramer acetate [GA] treatment [received for $6 months]).",fulltext,"CARE-MS II was a 2-year, randomized, rater-blinded, active comparator-controlled, head-to-head, trial of alemtuzumab (Lemtrada; Sanofi Genzyme, Cambridge, MA; 12 mg/day on 5 consecutive days at month 0 and on 3 consecutive days at month 12) vs SC IFN-b-1a (Rebif; EMD Serono, Rockland, MA; 44 mg 3 times weekly) in patients with RRMS with inadequate response to prior DMTs ($1 relapse during IFN-b or glatiramer acetate [GA] treatment [received for $6 months]).",100.0
674,PRECIS-2,Differences in study drug administration and unique adverse event profiles precluded effective double-blinding.,fulltext, Differences in study drug administration and unique adverse event profiles precluded effective double-blinding,99.09909909909909
674,PRECIS-2,"The following CARE-MS II tertiary endpoints were assessed: time to CDI ($1.0-point EDSS decrease from baseline sustained for $3 or $6 months, in patients with baseline score $2.0); proportion worsened ($0.5-point increase), stable, or improved ($0.5-point decrease) from baseline EDSS; mean change from baseline in MSFC and MSFC plus SLCLA scores and their components; and proportions worsened ($0.5 SD decrease), stable, or improved ($0.5 SD increase) from baseline MSFC scores.",fulltext,"The following CARE-MS II tertiary endpoints were assessed: time to CDI ($1.0-point EDSS decrease from baseline sustained for $3 or $6 months, in patients with baseline score $2.0); proportion worsened ($0.5-point increase), stable, or improved ($0.5-point decrease) from baseline EDSS; mean change from baseline in MSFC and MSFC plus SLCLA scores and their components; and proportions worsened ($0.5 SD decrease), stable, or improved ($0.5 SD increase) from baseline MSFC scores.",100.0
674,PRECIS-2,Reported p values are nominal and not adjusted for multiple comparisons.,fulltext,Reported p values are nominal and not adjusted for multiple comparisons.,100.0
674,PRECIS-2,"Patients were assessed using the 4-component, MSFC plus SLCLA score incorporating Z scores from binocular, 1.25% contrast testing.",fulltext," Patients were also assessed using the 4-component, MSFC plus SLCLA score incorporating Z scores from binocular, 1.25% contrast testing",99.23076923076923
674,PRECIS-2,"Percentage of patients with recent prestudy relapse was also equivalent between groups (alemtuzumab, 32%; SC IFN-b-1a, 33%).",fulltext,"Percentage of patients with recent prestudy relapse was also equivalent between groups (alemtuzumab, 32%; SC IFN-b-1a, 33%).",100.0
674,PRECIS-2,"Blinded raters performed EDSS assessments at baseline, every 3 months, and when relapse was suspected.",fulltext,"Blinded raters performed EDSS assessments at baseline, every 3 months, and when relapse was suspected.",100.0
674,PRECIS-2,The trial is registered with ClinicalTrials.gov (NCT00548405). All procedures were approved by local institutional ethics review boards of participating sites.,fulltext, This trial is registered with ClinicalTrials.gov (NCT00548405). All procedures were approved by local institutional ethics review boards of participating sites,98.74213836477988
674,PRECIS-2,The trial does not provide detailed information on the specific characteristics of the participating sites.,prompt,the full text does not contain enough information to assess a specific ,42.990654205607484
675,PRECIS-2,"Primary outcomes included disease-specific and disease-aspecific HRQOL, depression, and fatigue.",fulltext,"Primary outcomes included disease-specific and disease-aspecific HRQOL, depression, and fatigue.",100.0
675,PRECIS-2,"Mindfulness exercises included observation of sensory, affective, and cognitive domains of perceptible experience.",fulltext,"Mindfulness exercises included observation of sensory, affective, and cognitive domains of perceptible experience.",100.0
675,PRECIS-2,"MBI participants reported practicing, on average, 5.11 times/week (SD 2.24; CI 4.59 –5.64 times), a total time average of 76% of assigned homework (SD 13.80; CI 72.76%–79.25%). Amount of practice correlated with improvements in PQOLC, depression, and fatigue (r = 0.25–0.31; p < 0.04).",fulltext,"MBI participants reported practicing, on average, 5.11 times/week (SD 2.24; CI 4.59 –5.64 times), a total time average of 76% of assigned homework (SD 13.80; CI 72.76%–79.25%). Amount of practice correlated with improvements in PQOLC, depression, and fatigue (r  0.25– 0.31; p  0.04).",100.0
675,PRECIS-2,"MBI closely followed the program of mindfulness-based stress reduction and included 1) a personal intake interview to define realistic goals of participants and establish personal rapport; 2) 8 weekly 2.5-hour classes in mindfulness practices (10 –15 participants/group; exercises did not exceed patients’ level of functioning); 3) one Saturday, 7-hour session at week 6; 4) homework assignments (approximately 40 minutes/day), emphasized as essential to success of the program; 5) a postintervention interview to evaluate personal experiences, goal attainment, and future maintenance of acquired skills.",fulltext,"MBI closely followed the program of mindfulness-based stress reduction 23 and included 1) a personal intake interview to define realistic goals of participants and establish personal rapport; 2) 8 weekly 2.5-hour classes in mindfulness practices (10 –15 participants/group; exercises did not exceed patients’ level of functioning); 3) one Saturday, 7-hour session at week 6; 4) homework assignments (approximately 40 minutes/day), emphasized as essential to success of the program; 5) a postintervention interview to evaluate personal experiences, goal attainment, and future maintenance of acquired skills.",100.0
675,PRECIS-2,"Employing intention-to-treat analysis, MBI, compared with UC, improved nonphysical dimensions of primary outcomes at postintervention and follow-up (p < 0.002); effect sizes, 0.4–0.9 posttreatment and 0.3–0.5 at follow-up.",fulltext,"Employing intention-to-treat analysis, MBI, compared with UC, improved nonphysical dimensions of primary outcomes at postintervention and follow-up (p  0.002); effect sizes, 0.4–0.9 posttreatment and 0.3–0.5 at follow-up.",100.0
675,PRECIS-2,"Assessments were made at baseline, postintervention, and 6 months follow-up.",fulltext,"Assessments were made at baseline, postintervention, and 6 months follow-up.",100.0
675,PRECIS-2,"Eligible patients completed all preintervention assessments before randomization. Randomization was conducted by the principal investigator who had no prior contact with patients and was fully blinded to all patient information, except study identification number of patients.",fulltext,"Eligible patients completed all preintervention assessments before randomization. Randomization was conducted by the principal investigator who had no prior contact with patients and was fully blinded to all patient information, except study identification number of patients.",100.0
675,PRECIS-2,"All patients in the usual care (UC) group (and in the MBI group) received regular, currently optimal medical care during the duration of the study, as provided by the neurology department of the hospital.",fulltext,"All patients in the usual care (UC) group (and in the MBI group) received regular, currently optimal medical care during the duration of the study, as provided by the neurology department of the hospital.",100.0
675,PRECIS-2,A total of 164 patients self-referred to the study. Eleven were excluded and 3 declined to participate (figure 1). The remaining 150 patients were randomized.,fulltext,A total of 164 patients self-referred to the study. Eleven were excluded and 3 declined to participate (figure 1). The remaining 150 patients were randomized.,100.0
677,PRECIS-2,a month after t2 a follow up measurement was performed (t3) for the intervention group.,fulltext,a month after t2 a follow up measurement was performed (t3) for the intervention group.,100.0
677,PRECIS-2,"the main research question in this validation trial clinical assessment of the HeLLODOc tele-rehabilitation service was: is the use of the H-caD system for one month at least as good as usual care for the arm/hand function in stroke, tBI and MS patients?",fulltext,"ele-rehAbIlItAtIon clInIcAl trIAl was: is the use of the H-caD system for one month at least as good as usual care for the arm/hand function in stroke, tBI and MS patients?",65.35433070866141
677,PRECIS-2,"the actual intervention with the H-caD system at home consisted of one month, whereby the patients had an average of one training session a day lasting 30 minutes for at least 5 days a week.",fulltext,"the actual intervention with the H-caD system at home consisted of one month, whereby the patients had an average of one training session a day lasting 30 minutes for at least 5 days a week.",100.0
677,PRECIS-2,the goal of the clinical trial was to show that the effect of a new treatment (H-caD) is equal effective as the existing treatment (usual care).,fulltext,the goal of the clinical trial was to show that the effect of a new treatment (H-caD) is equal effective as the existing treatment (usual care).,100.0
677,PRECIS-2,"Patients were recruited from Unità Organica di riabilitazione Intensiva Neuromotoria (UOrIN, Italy), Foundation Institute Guttmann (FPING, Spain) and from National Multiple Sclerosis centre (NMSc, Belgium).",fulltext,"Patients were recruited from Unità Organica di riabilitazione Intensiva Neuromotoria (UOrIN, Italy), Foundation Institute Guttmann (FPING, Spain) and from National Multiple Sclerosis centre (NMSc, Belgium).",100.0
677,PRECIS-2,"Subjects were eligible for recruiting if they met the following criteria: (1) age > 18 years; (2) established diagnosis of the specific pathological condition MS, stroke or tBI; (3) nine hole peg test (NHPG) performed in more than 25 seconds; (4) ability to move at least one peg in 180 seconds during the NHPG; (5) sufficient autonomous functioning; (6) internet connection or telephone line and reachable internet provider; (7) clinical status stable; (8) discharged from hospital or rehabilitation setting – person lives at home.",fulltext,"subjects were eligible for recruiting if they met the following criteria: (1) age > 18 years; (2) established diagnosis of the specific pathological condition MS, stroke or tBI; (3) nine hole peg test (NHPG) performed in more than 25 seconds; (4) ability to move at least one peg in 180 seconds during the NHPG; (5) sufficient autonomous functioning; (6) internet connection or telephone line and reachable internet provider; (7) clinical status stable; (8) discharged from hospital or rehabilitation setting – person lives at home.",100.0
677,PRECIS-2,the physicians of the three rehabilitation centres included patients following the inclusion and exclusion criteria.,fulltext,the physicians of the three rehabilitation centres included patients following the inclusion and exclusion criteria.,100.0
677,PRECIS-2,the patient and the therapist had a weekly scheduled videoconference.,fulltext,the patient and the therapist had a weekly scheduled videoconference.,100.0
677,PRECIS-2,all measurements were performed at the centre where the patient had been treated.,fulltext,all measurements were performed at the centre where the patient had been treated.,100.0
678,PRECIS-2,"Data were collected at baseline, 6, 12, 18, and 26 weeks on use of services, patient symptoms, other outcomes, and caregiver burden.",fulltext,"Data were collected at baseline, 6, 12, 18, and 26 weeks on use of services, patient symptoms, other outcomes, and caregiver burden.",100.0
678,PRECIS-2,The primary analysis was an intention-to-treat analysis.,fulltext," Analysis We planned an intention-to-treat analysis,",78.57142857142857
678,PRECIS-2,"Patients had one to three contacts (visits and/or phone calls) from the PCT, although a small number (around 12%) were referred for longer-term ‘community’ palliative care.",fulltext,"Patients had one to three contacts (visits and/or phone calls) from the PCT, although a small number (around 12%) were referred for longer-term ‘‘community’’ palliative care.",100.0
678,PRECIS-2,"The PCT undertook assessments, suggested ways to improve physical, emotional, social, and other problems, provided specialist welfare benefits advice and bereavement support, and liaised with and acted as a catalyst for local services, both primary and specialist teams.",fulltext,"The PCT undertook assessments, suggested ways to improve physical, emotional, social, and other problems, provided specialist welfare benefits advice and bereavement support, and liaised with and acted as a catalyst for local services, both primary and specialist teams.",100.0
678,PRECIS-2,The primary outcome was the cost-effectiveness of the PCT compared to usual care.,prompt," primary outcome, are children or elderly), or uses many selection tests not used in usual care.",65.4320987654321
678,PRECIS-2,The trial was conducted in South East London.,fulltext,"the trial (Fig. 1). Inclusion criteria were patients in South East London,",86.66666666666667
678,PRECIS-2,Patients in South East London who were severely affected by MS were referred by clinicians to the trial.,fulltext,Patients in South East London who were severely affected by MS were referred by clinicians to the trial.,100.0
678,PRECIS-2,"After baseline interview, patients were randomly allocated to either a multiprofessional palliative care team (PCT) immediately (fast track) or the control care group who continued best usual care for three months and then were offered the PCT.",fulltext,"After baseline interview, patients were randomly allocated to either a multiprofessional palliative care team (PCT) immediately (fast track) or the control care group who continued best usual care for three months and then were offered the PCT.",100.0
678,PRECIS-2,"The PCT comprised one part-time consultant in palliative medicine, one part-time clinical nurse specialist, one administrator, and one psychosocial worker, and was based in a large teaching hospital.",fulltext," PCT. 18,20 This comprised one part-time consultant in palliative medicine, one part-time clinical nurse specialist, one administrator, and one psychosocial worker, and was based in a large teaching hospital.",98.49246231155779
679,PRECIS-2,"CDT was given during three consecutive days in Zorghotel Spelderholt, Beekbergen, the Netherlands, a facility especially equipped for the accommodation of people with impaired health.",fulltext,"CDT was given during three consecutive days in Zorghotel Spelderholt, Beekbergen, the Netherlands, a facility especially equipped for the accommodation of people with impaired health.",100.0
679,PRECIS-2,"During CDT, safety aspects and adverse events were assessed and documented by the multidisciplinary team at the end of each day.",fulltext,"During CDT, safety aspects and adverse events were assessed and documented by the multidisciplinary team at the end of each day.",100.0
679,PRECIS-2,"Assessments were at baseline and at one, three and six months follow-up via online questionnaires.",fulltext,"Assessments were at baseline and at one, three and six months follow-up via online questionnaires ",100.0
679,PRECIS-2,"Eligibility criteria for patients: diagnosis RRMS since at least one year, EDSS score ≤4.0, no symptoms suggestive of a relapse, no relapse in the preceding four weeks, willing and capable of participating in the investigations, and having access to the internet for performing the web-based assessments.",fulltext,"Eligibility criteria for patients: diagnosis RRMS since at least one year, EDSS score ≤4.0, no symptoms suggestive of a relapse, no relapse in the preceding four weeks, willing and capable of participating in the investigations, and having access to the internet for performing the web-based assessments.",100.0
679,PRECIS-2,"The components of CDT are large group sessions, small group sessions, consultations (carrousel), a theatre evening, and start of the day with a joint activity (optional).",fulltext," Components. CDT’s components are large group sessions, small group sessions, consultations (carrousel), a theatre evening, and start of the day with a joint activity (optional) ",97.05882352941177
679,PRECIS-2,"Patients were recruited from all over the Netherlands by the patient organisation NMSF, Rotterdam, the Netherlands.",fulltext,"pants were recruited from all over the Netherlands by the patient organisation NMSF, Rotterdam, the Netherlands.",97.3913043478261
679,PRECIS-2,"All endpoints were analyzed according to the intention-to-treat principle using an ANCOVA with the 6-month value as dependent variable, and condition, baseline value, disease duration and gender as independent variables.",fulltext,"All endpoints were analyzed according to the intention-to-treat principle using an ANCOVA with the 6-month value as dependent variable, and condition, baseline value, disease duration and gender as independent variables.",100.0
679,PRECIS-2,"The primary study outcome was the change in control self-efficacy, assessed by the Multiple Sclerosis Self-Efficacy Scale (MSSES), at six months.",fulltext,"The primary study outcome was the change in control self-efficacy, assessed by the Multiple Sclerosis Self-Efficacy Scale (MSSES), at six months.",100.0
679,PRECIS-2,"The multidisciplinary team included a psychiatrist, psychiatric nurse, neurologist, registered nurse specialized in MS, physiotherapist, dance therapist, and a person with MS.",fulltext,"The multidisciplinary team included a psychiatrist, psychiatric nurse, neurologist, registered nurse specialized in MS, physiotherapist, dance therapist, and a person with MS.",100.0
680,PRECIS-2,All sessions (apart from the first session which was 1.5 h) were 1 h in duration and took place in a clinic room at the hospital.,fulltext,All sessions (apart from the first session which was 1.5 h) were 1 h in duration and took place in a clinic room at the hospital.,100.0
680,PRECIS-2,"Statistical analyses included a sample of 30 participants at pre, post and 20 weeks follow up and were undertaken controlling for gender and ambulation status.",fulltext,"sure. All statistical analyses included a sample of 30 participants at pre, post and 20 weeks follow up and were undertaken controlling for gender and ambulati",93.71069182389937
680,PRECIS-2,Inclusion criteria were: 1) having a definite diagnosis of MS from a neurologist; 2) being within 5 years of receiving a diagnosis of MS; 3) scoring at least 10 on the Beck Depression Inventory-II (BDI-II) [26]; 4) not currently undertaking other psychological treatment for depressive or anxiety symptoms for the length of participation in the current trial; 5) speak English fluently; 6) no current or lifetime diagnosis of psychosis; 7) no current substance dependency; 8) no gross cognitive impairment; and 9) no changes to medications prior and during involvement in the trial.,fulltext,Inclusion criteria were: 1) having a definite diagnosis of MS from a neurologist; 2) being within 5 years of receiving a diagnosis of MS; 3) scoring at least 10 on the Beck Depression Inventory-II (BDI-II) [26]; 4) not currently undertaking other psychological treatment for depressive or anxiety symptoms for the length of participation in the current trial; 5) speak English fluently; 6) no current or lifetime diagnosis of psychosis; 7) no current substance dependency; 8) no gross cognitive impairment; and 9) no changes to medications prior and during involvement in the trial.,100.0
680,PRECIS-2,"The study took place at a large teaching and research hospital in Melbourne, Australia.",fulltext,"The study took place at a large teaching and research hospital in Melbourne, Australia.",100.0
680,PRECIS-2,"Participants were recruited through neurologists working in a large MS outpatient clinic at the hospital, advertisements on MS related websites and local press releases.",fulltext,"Participants were recruited through neurologists working in a large MS outpatient clinic at the hospital, advertisements on MS related websites and local press releases.",100.0
680,PRECIS-2,All participants in the CBT intervention reported reading and completing all of the materials provided for homework and reported that the intervention was 'very useful'.,fulltext,All participants in the CBT intervention reported reading and completing all of the materials provided for homework and reported that the intervention was 'very useful'.,100.0
680,PRECIS-2,A senior clinical psychologist and a provisional clinical psychologist (supervised by the clinical psychologist) provided the intervention.,fulltext,A senior clinical psychologist and a provisional clinical psychologist (supervised by the clinical psychologist) provided the intervention.,100.0
680,PRECIS-2,"All participants completed the pre, post and 20 week follow up questionnaires.",fulltext,"All participants completed the pre, post and 20 week follow up questionnaires.",100.0
680,PRECIS-2,The primary outcome was level of depressive symptoms at post and 3 month follow up which was measured with the Beck Depression Inventory-II (BDI-II) [26].,fulltext,The primary outcome was level of depressive symptoms at post and 3 month follow up which was measured with the Beck Depression Inventory-II (BDI-II) [26].,100.0
681,PRECIS-2,The primary outcome measure was 25-foot (7.6 m) walk time.,fulltext,The primary outcome measure was 25-foot (7.6 m) walk time.,100.0
681,PRECIS-2,"The same physiotherapist was present at both sites; however, fitness instructors were different between sites.",fulltext,The same physiotherapist was present at both sites; however fitness instructors were different between sites.,99.0909090909091
681,PRECIS-2,"All outcome measures were analysed on the basis of intention to treat, with all variables summarized and comparisons made between groups and over time.",fulltext,"All outcome measures were analysed on the basis of intention to treat, with all variables summarized and comparisons made between groups and over time.",100.0
681,PRECIS-2,"Participants completed a circuit of 8–12 different exercises for 1 minute each, having a rest (of a minimum of 1 minute) before moving to the next exercise. Not all exercises were performed at all classes, and in week 9 a fifth level of difficulty was added to some of the exercises to encourage progress.",fulltext,"Participants completed a circuit of 8–12 different exercises for 1 minute each, having a rest (of a minimum of 1 minute) before moving to the next exercise. Not all exercises were performed at all classes, and in week 9 a fifth level of difficulty was added to some of the exercises to encourage progress.",100.0
681,PRECIS-2,"Participants had a confirmed diagnosis of multiple sclerosis, an Extended Disability Status Scale score of 5 (ambulatory without aid or rest for about 200 m) to 6.5 (constant bilateral assistance required to walk about 20 m without resting), stable rehabilitation and drug therapy for 30 days before entry into the study, cognitive scores of over 24 on the Mini-Mental State Examination, and access to the intervention sites using their own or public transport.",fulltext,"Participants had a confirmed diagnosis of multiple sclerosis, an Extended Disability Status Scale 33 score of 5 (ambulatory without aid or rest for 580 Clinical Rehabilitation 26(7) about 200 m) to 6.5 (constant bilateral assistance required to walk about 20 m without resting), stable rehabilitation and drug therapy for 30 days before entry into the study, cognitive scores of over 24 on the Mini-Mental State Examination 34 and access to the intervention sites using their own or public transport.",100.0
681,PRECIS-2,The intervention took place at two different geographical locations (Site A and Site B).,fulltext,The intervention took place at two different geographical locations (Site A and Site B).,100.0
681,PRECIS-2,Participants were provided with exercise progress cards and were asked to record which level they performed each exercise at each session.,fulltext,Participants were provided with exercise progress cards and were asked to record which level they performed each exercise at each session.,100.0
681,PRECIS-2,"Outcome measures were carried out within the local hospital's rehabilitation unit. They were taken at baseline, after 8 and 12 weeks of the intervention period (i.e., either the exercise class or usual care).",fulltext,"Outcome measures were carried out within the local hospital’s rehabilitation unit. They were taken at baseline, after 8 and 12 weeks of the intervention period (i.e. either the exercise class or usual care).",99.51923076923077
681,PRECIS-2,Of the 873 patients on the clinical register for multiple sclerosis 159 patients were deemed suitable for the study. These people were sent invitation letters and participant information sheets. Forty-three potential participants expressed an interest in participating.,fulltext,Of the 873 patients on the clinical register for multiple sclerosis 159 patients were deemed suitable for the study. These people were sent invitation letters and participant information sheets. Forty-three potential participants expressed an interest in participating.,100.0
