publication_id,tool,quote,best_match_source,best_match,similarity
695,PRECIS-2,"Participants whose clinical features appeared incompatible with the recorded diagnosis were excluded, as were those with neurological complications of primarily non-neurological conditions such as diabetes mellitus, or additional causes of severe disability.",fulltext,"Participants whose clinical features appeared incompatible with the recorded diagnosis were excluded, as were those with neurological complications of primarily non-neurological conditions such as diabetes mellitus, or additional causes of severe disability.",100.0
695,PRECIS-2,"At interview, participants were asked 'In the past 12 months, have you fallen? Have you had a skin sore?'",fulltext," interview, participants were asked 'In the past 12 months, have you fallen? Have you had a skin sore?'",98.09523809523809
695,PRECIS-2,Thirty-six of 68 eligible practices (53%) agreed to take part and identified 438 patients.,fulltext,Thirty-six of 68 eligible practices (53%) agreed to take part and identified 438 patients.,100.0
695,PRECIS-2,"An expert panel reviewed baseline data and advised on actions most likely to promote each individual's physical, social, and psychological well-being.",fulltext,"an expert panel which advised on actions most likely to promote each individual's physical, social and psychological well-being.",83.33333333333334
695,PRECIS-2,The comparison group received standardized printed information delivered to their home.,fulltext,The comparison group (CoG) received standardized printed information delivered to their home.,100.0
695,PRECIS-2,"In order to preserve a focus on primarily physical disabilities, dementing disorders such as Alzheimer's disease were not included.",fulltext,"In order to preserve a focus on primarily physical disabilities, dementing disorders such as Alzheimer's disease were not included.",100.0
695,PRECIS-2,"Information on adverse events was collected by phone at two-monthly intervals between baseline and 12-month assessments, when a general enquiry was made without specific reference to falls or sores.",fulltext,"Information on adverse events was collected by phone at two-monthly intervals between baseline and 12-month assessments, when a general enquiry was made without specific reference to falls or sores.",100.0
696,PRECIS-2,"IDG: Patients who discontinued natalizumab therapy at once and initiated another DMT (interferon, GA therapy or an oral DMT-fingolimod, dimethyl fumatate or teriflunomide) at 1–6 months following the last natalizumab infusion (1–2 months for the injectable DMTs and 3–6 months for the oral DMTs) and tapered group (TG): patients administered two additional natalizumab infusions, one at 6 weeks and one at 8 weeks (14 weeks from study entry).",fulltext,"IDG: Patients who discontinued natalizumab therapy at once and initiated another DMT (interferon, GA therapy or an oral DMTfingolimod, dimethyl fumatate or teriflunomide) at 1–6 months following the last natalizumab infusion (1–2 months for the injectable DMTs and 3–6 months for the oral DMTs) and tapered group (TG): patients administered two additional natalizumab infusions, one at 6 weeks and one at 8 weeks (14 weeks from study entry).",99.77375565610859
696,PRECIS-2,Patients in both groups may have received additional optional treatment with intravenous myethylprednisolone (IVMP) in the first 6 months post-natalizumab discontinuation.,fulltext,Patients in both groups may have received additional optional treatment with intravenous myethylprednisolone (IVMP) in the first 6 months post-natalizumab discontinuation.,100.0
696,PRECIS-2,Candidates were excluded from the study if active disease was identified at baseline per clinical (presence of a relapse during the previous 30 days) and/or MRI evaluation (active gadolinium (Gd)-enhancing lesions).,fulltext,Candidates were excluded from the study if active disease was identified at baseline per clinical ( presence of a relapse during the previous 30 days) and/or MRI evaluation (active gadolinium (Gd)-enhancing lesions).,100.0
696,PRECIS-2,Participants who satisfied the inclusion criteria were randomised at baseline (week 0) to either the IDG or the TG according to a concealed computer-generated randomisation schedule.,fulltext,Participants who satisfied the inclusion criteria were randomised at baseline (week 0) to either the IDG or the TG according to a concealed computer-generated randomisation schedule.,100.0
696,PRECIS-2,"Standardised MRI was performed at baseline, 6 and 12 months from the last natalizumab infusion.",fulltext,"Standardised MRI was performed at baseline, 6 and 12 months from the last natalizumab infusion.",100.0
696,PRECIS-2,"Statistical analyses were carried out using IBM SPSS Statistics 22 (IBM Corp, Armonk, New York, USA).",fulltext,"Statistical analyses were carried out using IBM SPSS Statistics 22 (IBM Corp, Armonk, New York, USA).",100.0
696,PRECIS-2,Fifty relapsing patients with multiple sclerosis (MS) who had been on natalizumab therapy ≥24 months and were contemplating natalizumab discontinuation were enrolled.,fulltext,Fifty relapsing patients with multiple sclerosis (MS) who had been on natalizumab therapy ≥24 months and were contemplating natalizumab discontinuation were enrolled.,100.0
696,PRECIS-2,The primary objective of this study was to compare two modes of natalizumab cessation interventions: immediate discontinuation group (IDG) versus a TG approach as measured by serial MRI and number of relapses during a 12-month period in patients treated with natalizumab for at least 24 months.,fulltext,The primary objective of this study was to compare two modes of natalizumab cessation interventions: immediate discontinuation group (IDG) versus a TG approach as measured by serial MRI and number of relapses during a 12-month period in patients treated with natalizumab for at least 24 months.,100.0
696,PRECIS-2,"This was a prospective, phase IV, 12-month, open-label, single-center single-blinded (MRI) randomised study.",fulltext,"This was a prospective, phase IV, 12-month, open-label, single-center single-blinded (MRI) randomised study.",100.0
697,PRECIS-2,"Two baseline assessments were conducted 8 weeks apart to evaluate the stability of clinical presentation, with presentation considered stable if there was no significant difference between baseline assessments.",fulltext,"Two baseline assessments were conducted 8 weeks apart to evaluate the stability of clinical presentation, with presentation considered stable if there was no significant difference between baseline assessments.",100.0
697,PRECIS-2,The primary outcome was gait speed (10-meter walk test).,fulltext,The primary outcome was gait speed (10-meter walk test).,100.0
697,PRECIS-2,"Eligible participants were excluded from the study if they were already engaged in a formal exercise program lasting >30 minutes twice per week, experienced an exacerbation within the past 4 weeks, had their MS immunomodulation medications altered in the previous 4 weeks or during the trial period, or declined to be randomly allocated.",fulltext,"Eligible participants were excluded from the study if they were already engaged in a formal exercise program lasting >30 minutes twice per week, experienced an exacerbation within the past 4 weeks, had their MS immunomodulation medications altered in the previous 4 weeks or during the trial period, or declined to be randomly allocated.",100.0
697,PRECIS-2,Secondary outcomes were gait endurance (6-minute walk test) and balance (Berg Balance Scale).,fulltext,Secondary outcomes were gait endurance (6-minute walk test) and balance (Berg Balance Scale).,100.0
697,PRECIS-2,A total of 77 people were screened; 50 people who met inclusion criterion were randomized into the home-based (n = 26) and the center-based group exercise groups (n = 26) over a 24-month period.,fulltext, A total of 77 people were screened; 50 people who met inclusion criterion were randomized into the home-based (n = 24) and the center-based group exercise groups (n = 26) over a 24-month period,98.96907216494846
697,PRECIS-2,"The exercise program for both groups included two, 60-minute sessions per week, held at least 2 days apart for 8 weeks.",fulltext,"The exercise program for both groups included two, 60-minute sessions per week, held at least 2 days apart for 8 weeks.",100.0
697,PRECIS-2,"Participants in both groups were encouraged to maintain their usual activity levels and engagement in any other exercise throughout the trial, with any variation self-reported to the treating physiotherapist.",fulltext,"Participants in both groups were encouraged to maintain their usual activity levels and engagement in any other exercise throughout the trial, with any variation self-reported to the treating physiotherapist.",100.0
697,PRECIS-2,Community dwelling people with MS were recruited through the Multiple Sclerosis Society of New South Wales and South Australia.,fulltext,Community dwelling people with MS were recruited through the Multiple Sclerosis Society of New South Wales and South Australia.,100.0
697,PRECIS-2,Differences in outcome measures between the baseline and pre-assessments were compared using paired samples t-tests.,fulltext, Differences in outcome measures between the baseline and pre-assessments were compared using paired samples t-tests,99.13793103448276
697,PRECIS-2,The center-based groups of four to six were supervised by a physiotherapist.,fulltext,The center-based groups of four to six were supervised by a physiotherapist.,100.0
697,PRECIS-2,The home-based group was provided with telephone support.,fulltext,The home-based group was provided with telephone support.,100.0
697,PRECIS-2,"Participants attended a local community center to complete all assessments at pre-intervention (week 0), post-intervention (week 8), and at follow-up (week 16).",fulltext,"Participants attended a local community center to complete all assessments at pre-intervention (week 0), post-intervention (week 8), and at follow-up (week 16).",100.0
697,PRECIS-2,Data were analyzed according to the intention-to-treat principle.,fulltext, Data were analyzed according to the intention-totreat principle,96.92307692307692
697,PRECIS-2,"Inclusion criteria were the following: diagnosis of MS made by a neurologist, able to walk 10 meters with or without an aid within 2 minutes, no relapse of their MS in the past 4 weeks, and no other neurological or orthopedic condition that would affect their function.",fulltext,"Inclusion criteria were the following: diagnosis of MS made by a neurologist, able to walk 10 meters with or without an aid within 2 minutes, no relapse of their MS in the past 4 weeks, and no other ",73.97769516728626
697,PRECIS-2,The center- and home-based groups completed an 8-week progressive functional and balance training exercise program.,fulltext,The center- and home-based groups completed an 8-week progressive functional and balance training exercise program.,100.0
697,PRECIS-2,"They were individualized, specific, progressed in load, and performed at a moderate to high intensity.",fulltext,"They were individualized, specific, progressed in load, and performed at a moderate to high intensity.",100.0
697,PRECIS-2,"Exercises were aimed at improving gait speed, endurance, and balance.",fulltext,"Exercises were aimed at improving gait speed, endurance, and balance.",100.0
697,PRECIS-2,"During the 8-week intervention, participants in the home group reported completing a lower proportion of exercise sessions than those in the group exercise program (mean percentage of sessions completed 45% versus 83% P < .001).",fulltext," During the 8-week intervention, participants in the home group reported completing a lower proportion of exercise sessions than those in the group exercise program (mean percentage of sessions completed 45% versus 83% P < .001)",99.56140350877193
705,PRECIS-2,Follow-up occurred at 12 wk (both groups) and 12 months (intervention group only to explore the sustainability of long-term change).,fulltext,Follow-up occurred at 12 wk (both groups) and 12 months (intervention group only to explore the sustainability of long-term change).,100.0
705,PRECIS-2,"Recruitment occurred using a variety of methods (e.g., hockey team e-mail blasts and social media accounts, study website, posters, traditional media advertisements, word of mouth, direct contact at team arena).",fulltext,"Recruitment occurred using a variety of methods (e.g., hockey team e-mail blasts and social media accounts, study Web site (http://hockeyfansintraining.org/), posters, traditional media advertisements, word of mouth, direct contact at team arena).",100.0
705,PRECIS-2,We analyzed outcome data to examine the potential effectiveness of the Hockey FIT program on the basis of an intent-to-treat approach.,fulltext,We analyzed outcome data to examine the potential effectiveness of the Hockey FIT program on the basis of an intent-to-treat approach.,100.0
705,PRECIS-2,"Eligible participants were male 35–65 yr old with a BMI of Q28 kgIm^(−2) and met PA safety requirements (i.e., no risk indicated by the Physical Activity Readiness Questionnaire [36] or clearance from a health care provider).",fulltext,"Eligible participants were male 35–65 yr old with a BMI of Q28 kgIm j2 and met PA safety requirements (i.e., no risk indicated by the Physical Activity Readiness Questionnaire [36] or clearance from a health care provider).",98.66666666666667
705,PRECIS-2,"Program sessions comprised the following: 1) classroom-based teaching of behavior change techniques and simple information sharing on PA and healthy eating, delivered to encourage participant interaction and mutual learning, and 2) exercise sessions where men performed aerobic, strength, and flexibility exercises, incorporating their passion for hockey off the ice.",fulltext,"Program sessions comprised the following: 1) classroom-based teaching of behavior change techniques and simple information sharing on PA and healthy eating, delivered to encourage participant interaction and mutual learning, and 2) exercise sessions where men performed aerobic, strength, and flexibility exercises, incorporating their passion for hockey off the ice.",100.0
705,PRECIS-2,"Incentives were also provided as part of the program to encourage program attendance and engagement (e.g., free promotional materials from hockey teams and attendance raffle for hockey-related prizes held during session 12).",fulltext,"Incentives were also provided as part of the program to encourage program attendance and engagement (e.g., free promotional materials from hockey teams and attendance raffle for hockey-related prizes held during session 12).",100.0
705,PRECIS-2,"The Hockey FIT program was delivered over 12 weekly, 90-min sessions by Hockey FIT coaches (coach to participant ratio 2:20) from the central research team.",fulltext,"The Hockey FIT program was delivered over 12 weekly, 90-min sessions by Hockey FIT coaches (coach to participant ratio 2:20) from the central research team ",100.0
705,PRECIS-2,"We used a pragmatic approach for the program venue at each site, using a combination of the hockey team’s arena and an affiliated health club facility.",fulltext,"We used a pragmatic approach for the program venue at each site, using a combination of the hockey team_s arena and an affiliated health club facility.",99.33774834437085
705,PRECIS-2,The planned primary outcome for the definitive trial was the difference between groups in mean weight loss (kg) and percentage weight change from baseline to 12 wk.,fulltext,The planned primary outcome for the definitive trial was the difference between groups in mean weight loss (kg) and percentage weight change from baseline to 12 wk.,100.0
712,PRECIS-2,"The averages for the pain measured using the VAS were not different for the three groups that were a part of the study (p-value=0.0929), however they were less in the acupressure groups immediately after receiving the treatment (p-value=<0.0001). This was also the case where the treatment lasted for 1 hour (p-value=0.0001). This was the case in comparison with placebo and control groups.",fulltext,"The averages for the pain measured using the VAS were not different for the three groups that were a part of the study (p-value=0.0929), however they were less in the acupressure groups immediately after receiving the treatment (p-value=<0.0001). This was also the case where the treatment lasted for 1 hour (p-value=0.0001). This was the case in comparison with placebo and control groups.",100.0
712,PRECIS-2,All of the pregnant women in labor where encouraged during the CB to breath in and out deeply in the direction of the thorax during the contractions and the intervals in orde for their bodies to be totally relaxed (slow thorax-abdomen breathing rhythm).,fulltext,All of the pregnant women in labor where encouraged during the CB to breath in and out deeply in the direction of the thorax during the contractions and the intervals in orde for their bodies to be totally relaxed (slow thorax-abdomen breathing rhythm).,100.0
712,PRECIS-2,The Kruskal-Wallis test was used to make comparisons between the groups in relation to quantitative variables. The Mann-Whitney test was used in cases where significant differences were found for multiple comparisons. The Chi-squared test was used in relation to the association between groups and variables categories. The Exact Fisher test was used in cases where there were at least 20% of the expected values being less than five.,fulltext,The Kruskal-Wallis test was used to make comparisons between the groups in relation to quantitative variables. The Mann-Whitney test was used in cases where significant differences were found for multiple comparisons. The Chi-squared test was used in relation to the association between groups and variables categories. The Exact Fisher test was used in cases where there were at least 20% of the expected values being less than five.,100.0
712,PRECIS-2,"The pregnant women in labor were allocated through a sequential list of random numbers in blocks of six patients generated using the program Excel® and they were distributed in three groups: acupressure (SP6), touch group (TG)/placebo and the control group (CG).",fulltext,"The pregnant women in labor were allocated through a sequential list of random numbers in blocks of six patients generated using the program Excel® and they were distributed in three groups: acupressure (SP6), touch group (TG)/placebo and the control ",95.80152671755725
712,PRECIS-2,"The VAS was used and reused immediately after the treatment (VAS20) and 60 minutes after the treatment, once consent had been given by the pregnant women in labor to participate in the study.",fulltext,"The VAS was used and reused immediately after the treatment (VAS20) and 60 minutes after the treatment, once consent had been given by the pregnant women in labor to participate in the study.",100.0
712,PRECIS-2,The researcher that was responsible for applying the acupressure went through 32 hours’ worth of training.,fulltext,The researcher that was responsible for applying the acupressure went through 32 hours’ worth of training.,100.0
712,PRECIS-2,"The pregnant women were randomly divided into three groups at a university hospital in the suburbs of Sao Paulo, Brazil, in order to receive either acupressure treatment, a placebo or participate as part of a control group.",fulltext,"The pregnant women were randomly divided into three groups at a university hospital in the suburbs of Sao Paulo, Brazil, in order to receive either acupressure treatment, a placebo or participate as part of a control group.",100.0
712,PRECIS-2,"The SP6 group with the pregnant women in labor received deep pressure (± 5kg) with fast decompression applied to their thumbs which did not bring about any discomfort. The TG group received a superficial touch that was of very low intensity (± 100g). In both groups the contact was at the SP6 bilateral point, during the contractions, in one period of 20 minutes.",fulltext,"The SP6 group with the pregnant women in labor received deep pressure (± 5kg) with fast decompression applied to their thumbs which did not bring about any discomfort. The TG group received a superficial touch that was of very low intensity (± 100g) (15) . In both groups the contact was at the SP6 bilateral point, during the contractions, in one period of 20 minutes.",100.0
712,PRECIS-2,"The study was carried out between January and August of 2013. The subjects were pregnant women admitted to a teaching tertiary public hospital on the outskirts of the state of Sao Paulo, Brazil.",fulltext," was carried out between January and August of 2013. The subjects were pregnant women admitted to a teaching tertiary public hospital on the outskirts of the state of Sao Paulo, Brazil.",95.36082474226804
713,PRECIS-2,The intervention was provided for 6 months with a subsequent follow-up for additional 6 months.,fulltext,The intervention was provided for 6 months with a subsequent follow-up for additional 6 months.,100.0
713,PRECIS-2,The group (intervention) 9 time interaction from a repeated analysis of variance was used to measure whether or not the effect of intervention was statistically significant for variables that followed an approximately normal distribution.,fulltext,The group (intervention) 9 time interaction from a repeated analysis of variance was used to measure whether or not the effect of intervention was statistically significant for variables that followed an approximately normal distribution ,100.0
713,PRECIS-2,The treatment site was a clinical research centre located on a university-hospital campus.,fulltext,The treatment site was a clinical research centre located on a university-hospital campus.,100.0
713,PRECIS-2,"The 6-month partnership-based self-management programme had benefits on the perception of the intrusiveness of COPD and its treatment as regards lifestyles, activities and interests for young patients with the disease in its early stages.",fulltext,"The 6-month partnership-based self-management program had benefits on the perception of the intrusiveness of COPD and its treatment as regards lifestyles, activities and interests for young patients with the disease in its early stages.",99.15966386554622
713,PRECIS-2,Data were collected at baseline and at month 12.,fulltext,Data were collected at baseline and at month 12.,100.0
713,PRECIS-2,Patients in both groups found participation in the research useful and important.,fulltext,Patients in both groups found participation in the research useful and important.,100.0
713,PRECIS-2,Patients were recruited from each of the primary health care centres and lung physicians’ offices.,fulltext,Patients were recruited from each of the primary health care centres and lung physicians’ offices.,100.0
713,PRECIS-2,"Patients, 45-65 years old, with mild and moderate chronic obstructive pulmonary disease were invited with a family member.",fulltext,"Patients, 45-65 years old, with mild and moderate chronic obstructive pulmonary disease were invited with a family member.",100.0
713,PRECIS-2,The intervention was adjusted to the particular needs of young people with COPD in its early stages.,fulltext,this intervention. It was adjusted to the particular needs of young people with COPD in its early stages.,99.0
714,PRECIS-2,Four general practices in England.,fulltext,Four general practices in England.,100.0
714,PRECIS-2,Patients were free to arrange any consultations they wished.,fulltext,Patients were free to arrange any consultations they wished.,100.0
714,PRECIS-2,"Patients were excluded if the diagnosis of asthma had been made within the previous year, if they had chronic obstructive pulmonary disease, if communication difficulties made a telephone consultation impossible, or (at the general practitioner’s request) for major social or medical reasons.",fulltext,"Patients were excluded if the diagnosis of asthma had been made within the previous year, if they had chronic obstructive pulmonary disease, if communication difficulties made a telephone consultation impossible, or (at the general practitioner’s request) for major social or medical reasons.",100.0
714,PRECIS-2,Follow up questionnaires on morbidity and satisfaction with the consultation were sent to the patients at three months.,fulltext,Follow up questionnaires on morbidity and satisfaction with the consultation were sent to the patients at three months.,100.0
714,PRECIS-2,We wrote to all eligible patients inviting them to take part in the study.,fulltext,We wrote to all eligible patients inviting them to take part in the study.,100.0
714,PRECIS-2,From their computerised asthma registers the practices identified adults (>18 years) who had asked for a bronchodilator inhaler prescription in the previous six months but who had not had a routine asthma review in the preceding 11 months.,fulltext,From their computerised asthma registers the practices identified adults (>18 years) who had asked for a bronchodilator inhaler prescription in the previDepartment,67.36401673640167
714,PRECIS-2,Nurses were given no instructions about the content of the review except that it should reflect their normal practice and be appropriate to each patient’s clinical need.,fulltext,Nurses were given no instructions about the content of the review except that it should reflect their normal practice and be appropriate to each patient’s clinical need.,100.0
