publication_id,tool,quote,best_match_source,best_match,similarity
156,AMSTAR,"We decided, a priori, to limit our review to studies that reported outcomes of balloon dilatation (both endoscopically and under fluoroscopic control) of anastomotic strictures secondary to surgical repair of oesophageal atresia in children.",fulltext,"We decided, a priori, to limit our review to studies that reported outcomes of balloon dilatation (both endoscopically and under fluoroscopic control) of anastomotic strictures secondary to surgical repair of oesophageal atresia in children.",100.0
156,AMSTAR,"We decided, a priori, to limit our review to studies that reported outcomes of balloon dilatation (both endoscopically and under fluoroscopic control) of anastomotic strictures secondary to surgical repair of oesophageal atresia in children. There was no language restriction.",fulltext,"We decided, a priori, to limit our review to studies that reported outcomes of balloon dilatation (both endoscopically and under fluoroscopic control) of anastomotic strictures secondary to surgical repair of oesophageal atresia in children. There was no language restriction.",100.0
156,AMSTAR,"We searched the standard databases (January, 1960–May, 2012): MEDLINE, EMBASE and Cochrane Library Controlled Trials Register (CENTRAL) using the MeSH Terms “esophageal stricture”, “esophageal stenosis” and “balloon dilatation” to identify the studies.",fulltext,"We searched the standard databases (January, 1960–May, 2012): MEDLINE, EMBASE and Cochrane Library Controlled Trials Register (CENTRAL) using the MeSH Terms “esophageal stricture”, “esophageal stenosis” and “balloon dilatation” to identify the studies.",100.0
156,AMSTAR,Studies We identified 26 studies from our search that were deemed relevant and these were further scrutinised for eligibility for inclusion in this review. Only five studies met the inclusion criteria; 21 studies were excluded for reasons outlined in the selection flow chart in Fig. 1.,fulltext,Studies We identified 26 studies from our search that were deemed relevant and these were further scrutinised for eligibility for inclusion in this review. Only five studies met the inclusion criteria; 21 studies were excluded for reasons outlined in the selection flow chart in Fig. 1.,100.0
156,AMSTAR,"Table 1 Characteristics of studies included in the review Author, year [ref] Country Design Sample size Procedure n (boys: girls)",fulltext,"Table 1 Characteristics of studies included in the review Author, year [ref] Country Design Sample size Procedure n (boys: girls)",100.0
156,AMSTAR,We aimed to include both randomised and non-randomised studies as relevant to this review.,fulltext,We aimed to include both randomised and non-randomised studies as relevant to this review.,100.0
156,AMSTAR,"The success rate of balloon dilatations was reported in all studies [3, 6, 8, 9, 10], ranging from 70% to 100% successful.",fulltext,"The success rate of balloon dilatations was reported in all studies [3, 6, 8, 9, 10], ranging from 70% to 100% successful.",100.0
156,PRISMA,MINISYMPOSIUM Balloon dilatation of anastomotic strictures secondary to surgical repair of oesophageal atresia: a systematic review,fulltext,MINISYMPOSIUM Balloon dilatation of anastomotic strictures secondary to surgical repair of oesophageal atresia: a systematic review,100.0
156,PRISMA,"Abstract Surgical repair of oesophageal atresia may result in anastomotic strictures. These strictures are often treated by balloon dilatation (BD) and currently balloon dilatation (fluoroscopic or endoscopic) is the preferred primary treatment method. Here we review the current evidence of the outcomes of balloon dilatation of anastomotic strictures secondary to surgical repair of oesophageal atresia. We searched the standard databases (January, 1960–May, 2012) to identify all studies that reported outcomes of balloon dilatation of anastomotic strictures secondary to surgical repair of oesophageal atresia in children. Data, reported as median (range), were analysed and compared. Outcomes were success of BD, number of BD sessions, number of oesophageal perforations, need for other surgical interventions and mortality. Five studies were found to be relevant (n=139; 81 [58%] male children).",fulltext,"Abstract Surgical repair of oesophageal atresia may result in anastomotic strictures. These strictures are often treated by balloon dilatation (BD) and currently balloon dilatation (fluoroscopic or endoscopic) is the preferred primary treatment method. Here we review the current evidence of the outcomes of balloon dilatation of anastomotic strictures secondary to surgical repair of oesophageal atresia. We searched the standard databases (January, 1960–May, 2012) to identify all studies that reported outcomes of balloon dilatation of anastomotic strictures secondary to surgical repair of oesophageal atresia in children. Data, reported as median (range), were analysed and compared. Outcomes were success of BD, number of BD sessions, number of oesophageal perforations, need for other surgical interventions and mortality. Five studies were found to be relevant (n=139; 81 [58%] male children).",100.0
158,AMSTAR,The quality of the included studies was assessed using the Cochrane Risk of Bias tool for randomized controlled trials and the Newcastle-Ottawa Scale for observational studies.,prompt,the scientific quality of the included studies assessed and docu,30.113636363636363
158,AMSTAR,"The review was conducted by a team of experts in the field of Wilms tumor, including pediatric oncologists, surgeons, and radiologists.",prompt," reviews, textbooks, specialized registers, or experts in the particular field of ",35.55555555555555
158,AMSTAR,Disagreements between the two reviewers were resolved by a third reviewer.,fulltext,"mes between the 2 surgeries [24]. However, there were met",50.0
158,AMSTAR,"The search strategy included keywords related to Wilms tumor, nephrectomy, and nephron-sparing surgery.",fulltext,ed. Keywords: Pediatric; Renal tumor; Wilms tumor; Partial nephrectomy; Radical nephrectomy; Nephron-sparing surgery ,70.87378640776699
158,AMSTAR,The full text of the included studies was reviewed to assess eligibility based on the pre-specified inclusion and exclusion criteria.,fulltext,"the final review (Fig. 1). Of the 66 included studies, most (60, 91%) were retrospective cohorts or case series, including 1 administrative database analysis that also met inclusion criteria.",66.16541353383458
158,AMSTAR,"The review included a comprehensive search of multiple electronic databases, including PubMed, Embase, and the Cochrane Library, from inception to January 2021.",prompt," a comprehensive literature search performed? At least two electronic sources should be searched. The report must include years and databases used (e.g., Central, EMBASE, and MED",49.375
158,AMSTAR,The review included a meta-analysis of the included studies.,fulltext,"were included in the final review (Fig. 1). Of the 66 included studies,",75.0
158,AMSTAR,The search was limited to articles published in English.,prompt,there was a search for “grey literature” or “unpublished l,55.35714285714286
158,AMSTAR,Data were extracted from the included studies using a standardized data extraction form.,fulltext,data were presented in highly variable ways among the included studies. Owing to these di,55.68181818181819
158,AMSTAR,The review was conducted in accordance with the Preferred Reporting Items for Systematic Reviews and Meta-Analyses (PRISMA) guidelines.,fulltext, Preferred Reporting Items for Systematic reviews and Meta-Analyses (PRISMA) guidelines ,65.18518518518519
158,AMSTAR,Two independent reviewers screened the titles and abstracts of the identified studies for inclusion.,fulltext,. independently reviewed all study abstracts ,36.0
158,PRISMA,Abstract: ,prompt,Abstract: ,100.0
158,PRISMA,Conclusion: ,fulltext,conclusion ,91.66666666666666
158,PRISMA,Discussion: ,prompt,Discussion: ,100.0
158,PRISMA,Introduction: ,prompt,Introduction: ,100.0
159,AMSTAR,"The methodological quality of the included studies was assessed and documented using the Downs and Black checklist, with a maximum score of 32 for the optimal study quality.",fulltext," Methodological quality was assessed with the checklist proposed by Downs and Black, 5 with a maximum score of 32 for the optimal study quality.",69.36416184971098
159,AMSTAR,"In children with an anorectal malformation who received a colostomy, born between January 1990 and July 2012.",fulltext," children with an anorectal malformation who received a colostomy, born between January 1990 and July 2012.",98.1651376146789
159,AMSTAR,The baseline characteristics of the 180 children with a stoma are shown in Table 1.,fulltext,The baseline characteristics of the 180 children with a stoma are shown in ►Table 1.,100.0
159,AMSTAR,Not applicable as the review did not perform a meta-analysis.,prompt,"not applicable (for example, items P14, P15, P16, P21, P22, P23 in the context of a systematic review without a meta-analysis)",80.32786885245902
159,AMSTAR,"Studies were eligible for inclusion when they reported a series of neonates (newborns under the age of 28 days) whose anorectal malformation or Hirschsprung disease was treated with a stoma, and reported on stoma type and location, complications of stoma formation or closure or mortality rates.",fulltext,"Studies were eligible for inclusion when they reported a series of neonates (newborns under the age of 28 days) whose anorectal malformation or Hirschsprung disease was treated with a stoma, and reported on stoma type and location, complications of stoma formation or closure or mortality rates.",100.0
159,AMSTAR,Eight of these met the inclusion and exclusion criteria.,fulltext,Eight of these met the inclusion and exclusion criteria.,100.0
159,AMSTAR,"A systematic literature search was conducted in the PubMed, Embase, and Web of Science databases with the help of an experienced librarian. The general search terms were the same for the three databases, which are as follows: anorectal malformations, Hirschsprung disease, colostomy, and chil- dren.",fulltext,"A systematic literature search was conducted in the PubMed, Embase, and Web of Science databases with the help of an experienced librarian. The general search terms were the same for the three databases, which are as follows: anorectal malformations, Hirschsprung disease, colostomy, and chil- dren.",100.0
159,AMSTAR,"Two investigators (D.H. and C.S.) independently screened titles and abstracts of retrieved citations, retrieved full texts of eligible articles, and selected relevant articles matching the selection criteria described below.",fulltext,"Two investigators (D.H. and C.S.) independently screened titles and abstracts of retrieved citations, retrieved full texts of eligible articles, and selected relevant articles matching the selection criteria described below.",100.0
159,AMSTAR,Not applicable as the review did not report on the conflict of interest.,prompt,cause there were fewer than 10 included studies. A11. Was the conflict of interest ,62.5
159,AMSTAR,"Methodological quality was assessed with the checklist proposed by Downs and Black, with a maximum score of 32 for the optimal study quality.",fulltext,"Methodological quality was assessed with the checklist proposed by Downs and Black, 5 with a maximum score of 32 for the optimal study quality.",100.0
159,PRISMA,Discussion / Summary of evidence provided.,prompt,Discussion / Summary of evidence:,78.57142857142857
159,PRISMA,Methods / Information sources provided.,prompt,Methods / Information sources:,76.92307692307692
159,PRISMA,Methods / Data items provided.,prompt,Methods / Data items:,70.0
159,PRISMA,Not applicable as the review did not perform a meta-analysis.,prompt,"not applicable (for example, items P14, P15, P16, P21, P22, P23 in the context of a systematic review without a meta-analysis)",80.32786885245902
159,PRISMA,To Split or Not to Split: Colostomy Complications for Anorectal Malformations or Hirschsprung Disease: A Single Center Experience and a Systematic Review of the Literature,fulltext,To Split or Not to Split: Colostomy Complications for Anorectal Malformations or Hirschsprung Disease: A Single Center Experience and a Systematic Review of the Literature,100.0
159,PRISMA,Introduction / Objectives provided.,prompt,Introduction / Objectives: Provide,94.28571428571428
159,PRISMA,Methods / Eligibility criteria provided.,prompt,Methods / Eligibility criteria:,77.5
159,PRISMA,Methods / Data collection process provided.,prompt,Methods / Data collection process:,79.06976744186046
159,PRISMA,Methods / Search provided.,prompt,Methods / Search: Pr,73.07692307692308
159,PRISMA,Results / Study characteristics provided.,prompt,Results / Study characteristics:,78.04878048780488
159,PRISMA,Results / Risk of bias within studies provided.,prompt,Results / Risk of bias within studies: Pr,85.1063829787234
159,PRISMA,Discussion / Limitations provided.,prompt,Discussion / Limitations:,73.52941176470588
159,PRISMA,Abstract provided.,prompt,Abstract / Structured summary: Provide,88.88888888888889
159,PRISMA,Not applicable as the review did not report on the funding.,prompt,not applicable or not rel,38.983050847457626
159,PRISMA,Methods / Risk of bias in individual studies provided.,prompt,Methods / Risk of bias in individual studies:,83.33333333333334
159,PRISMA,Results / Study selection provided.,prompt,Results / Study selection:,74.28571428571429
159,PRISMA,Introduction provided.,prompt,Introduction / Objectives: Provide,90.9090909090909
159,PRISMA,Discussion / Conclusions provided.,prompt,Discussion / Conclusions: Provide,94.11764705882352
159,PRISMA,Not applicable as the review did not report on the protocol and registration.,prompt, Protocol and registration:,35.064935064935064
159,PRISMA,Methods / Study selection provided.,prompt,Methods / Study selection:,74.28571428571429
161,AMSTAR,"From the 94 citations initially identified, 12 studies [2, 3, 10–19] including 690 cases (338 cases for PBF and 352 cases for TIP) fulfilled the predefined inclusion criteria and were included in the final analysis.",fulltext,"From the 94 citations initially identified, 12 studies [2, 3, 10–19] including 690 cases (338 cases for PBF and 352 cases for TIP) fulfilled the predefined inclusion criteria and were included in the final analysis.",100.0
161,AMSTAR,"The effect measures estimated were odds ratio (OR) for dichotomous data and weighted mean difference for continuous data, both reported with 95 % confidence interval (CI). Statistical heterogeneity was assessed using the Chi square test with significance set at P < 0.10 and the I2 statistics [9]. Given the significant clinical heterogeneity between studies, the random-effects model was used for all comparisons. Evidence for publication bias was ascertained with funnel plot. All analyses were performed with software available from the Cochrane Initiative (Review Manager 5.2).",fulltext,"The effect measures estimated were odds ratio (OR) for dichotomous data and weighted mean difference for continuous data, both reported with 95 % confidence interval (CI). Statistical heterogeneity was assessed using the Chi square test with significance set at P \ 0.10 and the I 2 statistics [9]. Given the significant clinical heterogeneity between studies, the random-effects model was used for all comparisons. Evidence for publication bias was ascertained with funnel plot. All analyses were performed with software available from the Cochrane Initiative (Review Manager 5.2).",100.0
161,AMSTAR,"F. Wang, Y. Xu and H. Zhong are joint first authors and contributed equally to the paper.",fulltext,"F. Wang, Y. Xu and H. Zhong are joint first authors and contributed equally to the paper.",100.0
161,AMSTAR,"The eligibility determination, quality assessment and data extraction for each study were conducted independently by two of the authors (FRW and YHX) and conflicts were resolved by a third author (HJZ).",fulltext,"The eligibility determination, quality assessment and data extraction for each study were conducted independently by two of the authors (FRW and YHX) and conflicts were resolved by a third author (HJZ).",100.0
161,AMSTAR,"Among the included studies, there were seven RCTs [10–12, 15, 16, 18, 19] and five cohort studies [2, 3, 13, 14, 17], eleven studies [2, 3, 10–15, 17–19] studies published as full-text articles and one [16] as abstract, and nine studies [2, 3, 10, 12, 14, 15, 17–19] published in English and three [11, 13, 16] in other languages. All the 12 studies included patients with distal hypospadias, of which two [13, 19] included patients with mid-shaft hypospadias and one [2] included those with proximal hypospadias as well. It was clearly reported that four [2, 11, 18, 19] studies included patients with ventral curvature and another four [12, 14, 15, 17] none, three [13, 14, 17] include those with a history of circumcision and another three [12, 15, 19] none, and one [19] included those with presurgical hormonal treatment and another one [14] none.",fulltext,"Among the included studies, there were seven RCTs [10– 12, 15, 16, 18, 19] and five cohort studies [2, 3, 13, 14, 17], eleven studies [2, 3, 10–15, 17–19] published as full-text articles and one [16] as abstract, and nine studies [2, 3, 10, 12, 14, 15, 17–19] published in English and three [11, 13, 16] in other languages. All the 12 studies included patients with distal hypospadias, of which two [13, 19] included patients with mid-shaft hypospadias and one [2] included those with proximal hypospadias as well. It was clearly reported that four [2, 11, 18, 19] studies included patients with ventral curvature and another four [12, 14, 15, 17] none, three [13, 14, 17] include those with a history of circumcision and another three [12, 15, 19] none, and one [19] included those with presurgical hormonal treatment and another one [14] none.",99.06103286384976
161,AMSTAR,"The systematic search of the literature was performed using the electronic databases of PubMed (1950–), Embase (1988–) and Cochrane databases. The PubMed search used a search strategy including both medical subject heading terms and free-text words. The following terms were used: hypo-spadias, Snodgrass, TIP*, tubularized incised plate, tubularized incised-plate, Mathieu*, perimeatal-based flap, perimeatal flap, meatal-based flap and meatal based flap. No ‘‘language’’ or other limits were used. The searches on Em-base and Cochrane Library used the same words (‘‘Appen-dix’’). Subsequently, the query results were pooled. All titles and abstracts were reviewed initially to select studies for full review if they contained results of primary hypospadias repair including both the PBF and TIP techniques. Where the relevance of a study was unclear a review of the full text was undertaken. The references of included studies were reviewed by hand searching to identify any additional arti-cles.",fulltext,"The systematic search of the literature was performed using the electronic databases of PubMed (1950–), Embase (1988–) and Cochrane databases. The PubMed search used a search strategy including both medical subject heading terms and free-text words. The following terms were used: hypospadias, Snodgrass, TIP*, tubularized incised plate, tubularized incised-plate, Mathieu*, perimeatal-based flap, perimeatal flap, meatal-based flap and meatal based flap. No ‘‘language’’ or other limits were used. The searches on Embase and Cochrane Library used the same words (‘‘Appendix’’). Subsequently, the query results were pooled. All titles and abstracts were reviewed initially to select studies for full review if they contained results of primary hypospadias repair including both the PBF and TIP techniques. Where the relevance of a study was unclear a review of the full text was undertaken. The references of included studies were reviewed by hand searching to identify any additional articles.",99.59919839679358
161,AMSTAR,The systematic review and meta-analysis of studies comparing the perimeatal-based flap and tubularized incised-plate techniques for primary hypospadias repair and determine whether the two techniques had similar reported outcomes.,fulltext, systematic review and meta-analysis of studies comparing the perimeatal-based flap (PBF) and tubularized incised-plate (TIP) techniques for primary hypospadias repair and determine whether the two techniques had similar reported outcomes.,98.69565217391305
161,PRISMA,"From the 94 citations initially identified, 12 studies [2, 3, 10--19] including 690 cases (338 cases for PBF and 352 cases for TIP) fulfilled the predefined inclusion criteria and were included in the final analysis.",fulltext,"From the 94 citations initially identified, 12 studies [2, 3, 10–19] including 690 cases (338 cases for PBF and 352 cases for TIP) fulfilled the predefined inclusion criteria and were included in the final analysis ",99.53703703703704
161,PRISMA,"Methods The PubMed, Embase and Cochrane databases were searched using the terms: hypospadias, Snodgrass, TIP*, tubularized incised plate, tubularized incised-plate, Mathieu*, perimeatal-based flap, perimeatal flap, meatal-based flap and meatal based flap. No other limits were used. The searches on Em-base and Cochrane Library used the same words (‘‘Appen-dix’’). Subsequently, the query results were pooled. All titles and abstracts were reviewed initially to select studies for full review if they contained results of primary hypospadias repair including both the PBF and TIP techniques. Where the relevance of a study was unclear a review of the full text was undertaken. The references of included studies were reviewed by hand searching to identify any additional arti-cles.",fulltext," PubMed (1950–), Embase (1988–) and Cochrane databases. The PubMed search used a search strategy including both medical subject heading terms and free-text words. The following terms were used: hypospadias, Snodgrass, TIP*, tubularized incised plate, tubularized incised-plate, Mathieu*, perimeatal-based flap, perimeatal flap, meatal-based flap and meatal based flap. No ‘‘language’’ or other limits were used. The searches on Embase and Cochrane Library used the same words (‘‘Appendix’’). Subsequently, the query results were pooled. All titles and abstracts were reviewed initially to select studies for full review if they contained results of primary hypospadias repair including both the PBF and TIP techniques. Where the relevance of a study was unclear a review of the full text was undertaken. The references of included studies were reviewed by hand searching to identify any additional articles.",97.95134443021767
161,PRISMA,"Among the included studies, there were seven RCTs [10--12, 15, 16, 18, 19] and five cohort studies [2, 3, 13, 14, 17], eleven studies [2, 3, 10--15, 17--19] studies published as full-text articles and one [16] as abstract, and nine studies [2, 3, 10, 12, 14, 15, 17--19] published in English and three [11, 13, 16] in other languages. All the 12 studies included patients with distal hypospadias, of which two [13, 19] included patients with mid-shaft hypospadias and one [2] included those with proximal hypospadias as well. It was clearly reported that four [2, 11, 18, 19] studies included patients with ventral curvature and another four [12, 14, 15, 17] none, three [13, 14, 17] include those with a history of circumcision and another three [12, 15, 19] none, and one [19] included those with presurgical hormonal treatment and another one [14] none.",fulltext,"Among the included studies, there were seven RCTs [10– 12, 15, 16, 18, 19] and five cohort studies [2, 3, 13, 14, 17], eleven studies [2, 3, 10–15, 17–19] published as full-text articles and one [16] as abstract, and nine studies [2, 3, 10, 12, 14, 15, 17–19] published in English and three [11, 13, 16] in other languages. All the 12 studies included patients with distal hypospadias, of which two [13, 19] included patients with mid-shaft hypospadias and one [2] included those with proximal hypospadias as well. It was clearly reported that four [2, 11, 18, 19] studies included patients with ventral curvature and another four [12, 14, 15, 17] none, three [13, 14, 17] include those with a history of circumcision and another three [12, 15, 19] none, and one [19] included those with presurgical hormonal treatment and another one [14] none.",98.71495327102804
161,PRISMA,"Methods The PubMed, Embase and Cochrane databases were searched using the terms: hypospadias, Snodgrass, TIP*, tubularized incised plate, tubularized incised-plate, Mathieu*, perimeatal-based flap, perimeatal flap, meatal-based flap and meatal based flap. No other limits were used. Inclusion criteria included: primary hypospadias repair only; both including the PBF and TIP techniques; at least one of the quantitative outcomes obtainable from study; comparative studies.",fulltext,"Methods The PubMed, Embase and Cochrane databases were searched using the terms: hypospadias, Snodgrass, TIP*, tubularized incised plate, tubularized incised-plate, Mathieu*, perimeatal-based flap, perimeatal flap, meatal-based flap and meatal based flap. No other limits were used. Inclusion criteria included: primary hypospadias repair only; both including the PBF and TIP techniques; at least one of the quantitative outcomes obtainable from study; comparative studies.",100.0
