publication_id,tool,quote,best_match_source,best_match,similarity
125,PRISMA,The use of mechanical traction appears to be at least as effective as delayed primary anastomosis for the management of long-gap EA. Future prospective studies and the establishment of a prospective registry are required to further elucidate this issue.,fulltext,The use of mechanical traction appears to be at least as effective as delayed primary anastomosis for the management of long-gap EA. Future prospective studies and the establishment of a prospective registry are required to further elucidate this issue.,100.0
125,PRISMA,"Background: Long-gap esophageal atresia (EA) represents a challenging problem for pediatric surgeons, and a large number of techniques and approaches have been proposed. One of the more recent, initially published by Foker, is the use of mechanical traction to accelerate the growth of the esophageal ends and permit earlier primary anastomosis. The purpose of this study is to critically evaluate the existing literature on this topic and to compare the Foker technique to the more conventional delayed primary anastomosis. Methods: A systematic review and cumulative meta-analysis was performed, including all articles describing the Foker procedure or delayed primary anastomosis. Primary outcome was complications, and secondary outcome was time to final anastomosis. Results: Six articles on the Foker procedure met the criteria for inclusion. None were prospective or randomized. These articles represented 71 infants undergoing the Foker procedure, which were compared with 451 children from 44 studies utilizing delayed primary anastomosis. The Foker procedure was associated with a significantly lower risk of complications (leak, stricture, and gastroesophageal reflux), and with a significantly shorter time to definitive anastomosis. Conclusions: The use of mechanical traction appears to be at least as effective as delayed primary anastomosis for the management of long-gap EA. Future prospective studies and the establishment of a prospective registry are required to further elucidate this issue.",fulltext,"Background Long-gap esophageal atresia (EA) represents a challenging problem for pediatric surgeons, and a large number of techniques and approaches have been proposed. One of the more recent, initially published by Foker, is the use of mechanical traction to accelerate the growth of the esophageal ends and permit earlier primary anastomosis. The purpose of this study is to critically evaluate the existing literature on this topic and to compare the Foker technique to the more conventional delayed primary anastomosis. Methods A systematic review and cumulative meta-analysis was performed, including all articles describing the Foker technique or delayed primary anastomosis. Primary outcome was complications, and secondary outcome was time to final anastomosis. Results Six articles on the Foker procedure met the criteria for inclusion. None were prospective or randomized. These articles represented 71 infants undergoing the Foker procedure, which were compared with 451 children from 44 studies utilizing delayed primary anastomosis. The Foker procedure was associated with a significantly lower risk of complications (leak, stricture, and gastroesophageal reflux), and with a significantly shorter time to definitive anastomosis. Conclusions The use of mechanical traction appears to be at least as effective as delayed primary anastomosis for the management of long-gap EA. Future prospective studies and the establishment of a prospective registry are required to further elucidate this issue.",99.33862433862434
125,PRISMA,"All publications describing both surgical procedures were sought from the Cochrane Trials Register and the Cochrane Central Register of Controlled Trials database. All studies were identified through electronic searches of MEDLINE (1966 onward), Embase (1980 onward), and CINAHL (1982 onward), and from hand searching journals and conference proceedings. The terms ‘‘EA,’’ ‘‘long gap,’’ ‘‘Foker,’’ ‘‘laparotomy,’’ and ‘‘laparoscopy’’ were mapped to their corresponding MeSH (medical subject headings) terms and then combined. There were no language restrictions. Further results were obtained by manually searching for articles that were mentioned and cross-referencing the studies in the electronic search. Letters, editorials, commentaries, reviews, and lectures that did not contain original research data were excluded.",fulltext,"All publications describing both surgical procedures were sought from the Cochrane Trials Register and the Cochrane Central Register of Controlled Trials database. All studies were identified through electronic searches of MEDLINE (1966 onward), Embase (1980 onward), and CINAHL (1982 onward), and from hand searching journals and conference proceedings. The terms ‘‘EA,’’ ‘‘long gap,’’ ‘‘Foker, ‘‘laparotomy,’’ and ‘‘laparoscopy’’ were mapped to their corresponding MeSH (medical subject headings) terms and then combined. There were no language restrictions. Further results were obtained by manually searching for articles that were mentioned and cross-referencing the studies in the electronic search. Letters, editorials, commentaries, reviews, and lectures that did not contain original research data were excluded.",99.75698663426489
125,PRISMA,Studies which were designed to describe both procedures were selected for review.,fulltext,Studies which were designed to describe both procedures were selected for review.,100.0
125,PRISMA,We used the minor criteria to assess the methodological quality of these studies.,fulltext,We used the minor criteria to assess the methodological quality of these studies.,100.0
125,PRISMA,The purpose of this study is to critically evaluate the existing literature on this topic and to compare the Foker technique to the more conventional delayed primary anastomosis.,fulltext,The purpose of this study is to critically evaluate the existing literature on this topic and to compare the Foker technique to the more conventional delayed primary anastomosis.,100.0
125,PRISMA,"The overall numbers of study subjects managed in these publications were 71 infants, ranging from 1 to 60 newborns with long-gap EA per study. All infants had long-gap EA without TEF. Data about the initial gap length were reported in all studies with a mean of 5.4 cm (range 3--12.5 cm). No study reported data about the preoperative gap length. The time until an anastomosis could be achieved was reported in all studies with a mean of 14  8.2 days. The follow-up time was 5 years (range 0.2--10 years).",fulltext,"The overall numbers of study subjects managed in these publications were 71 infants, ranging from 1 to 60 newborns with long-gap EA per study. All infants had long-gap EA without TEF. Data about the initial gap length were reported in all studies with a mean of 5.4 cm (range 3–12.5 cm). No study reported data about the preoperative gap length. The time until an anastomosis could be achieved was reported in all studies with a mean of 14  8.2 days. The follow-up time was 5 years (range 0.2–10 years).",99.60474308300395
125,PRISMA,Mechanical Traction Techniques for Long-Gap Esophageal Atresia: A Critical Appraisal,fulltext,Mechanical Traction Techniques for Long-Gap Esophageal Atresia: A Critical Appraisal,100.0
125,PRISMA,"Esophageal atresia (EA) is a relatively common congenital malformation of unknown etiology with an incidence of 1 in 3,500 live births. Pure EA without tracheoesophageal fistula (TEF) is an uncommon variant, comprising 8% of all patients with EA, with an expected incidence of 1 in 40,000 live births. Improvements in prenatal diagnosis and care, advances in surgical technique, pediatric anesthesia, neonatal intensive care, and nutritional support have increased the survival rate in EA in recent years to approximately 95%. Although most children with EA can undergo primary repair in the neonatal period, the presence of prematurity, associated anomalies and long-gap EA may preclude an immediate primary end-to-end anastomosis. Thus, surgical management of patients with long-gap EA represents a major challenge to pediatric surgeons.",fulltext,"Esophageal atresia (EA) is a relatively common congenital malformation of unknown etiology with an incidence of 1 in 3,500 live births. Pure EA without tracheoesophageal fistula (TEF) is an uncommon variant, comprising 8% of all patients with EA, with an expected incidence of 1 in 40,000 live births. 1,2 Improvements in prenatal diagnosis and care, advances in surgical technique, pediatric anesthesia, neonatal intensive care, and nutritional support have increased the survival rate in EA in recent years to approximately 95%. 3 Although most children with EA can undergo primary repair in the neonatal period, the presence of prematurity, associated anomalies and long-gap EA may preclude an immediate primary end-to-end anastomosis. Thus, surgical management of patients with long-gap EA represents a major challenge to pediatric surgeons.",100.0
126,AMSTAR,"The review methods were described in detail and included specification of methods used to locate, select, extract and appraise studies, and to analyze and combine the data.",prompt,ibe methods used for assessing risk of bias of individual studies (including specification of wheth,32.55813953488372
126,AMSTAR,The scientific quality of the included studies was assessed using appropriate tools.,prompt,the scientific quality of the included studies used appropriate,73.80952380952381
126,AMSTAR,The methods for assessing the scientific quality of included studies were appropriate.,prompt, the scientific quality of the included studies used appropriate,66.27906976744187
126,AMSTAR,The conclusions were supported by the data presented.,fulltext, were plotted against the total patient,45.28301886792453
126,AMSTAR,The methods used for combining the findings of the included studies were described in detail.,prompt,the methods used to combine the findings of studies ,53.76344086021505
126,AMSTAR,The characteristics of the included studies were described in detail.,prompt,the characteristics of the included studies provided? In ,75.36231884057972
126,AMSTAR,The likelihood of publication bias was assessed.,prompt,the likelihood of publication bias assessed?,91.66666666666666
126,AMSTAR,The review was conducted by individuals who had no relationships that could bias their activities.,fulltext,This review was cen,17.3469387755102
126,AMSTAR,The review methods were established prior to the conduct of the review and did not change during its execution.,fulltext, Reviews and Meta-Analyses (PRISMA) was used in the formulation of the systematic review and ,43.24324324324324
126,AMSTAR,The scientific quality of the included studies was used appropriately in formulating conclusions.,prompt,the scientific quality of the included studies used appropriately in formulating conclusions?,95.87628865979381
126,AMSTAR,The scientific quality of the included studies was reported in detail.,prompt,the scientific quality of the included studies assessed an,77.14285714285715
126,PRISMA,Introduction: The introduction should include a rationale for the review and a description of the research question.,prompt,Introduction / Rationale: Describe the rationale for the review in,45.689655172413794
126,PRISMA,"Methods: The methods should include a description of any assessments of risk of bias that were conducted in individual studies (including study selection, data collection, and outcome reporting) and any assessments of risk of bias that were conducted across studies.",prompt, Methods / Risk of bias in individual studies: Describe methods used for assessing risk of bias of individual studies (including specification o,37.21804511278195
126,PRISMA,Methods: The methods should include a description of the methods used for assessing the quality of the review.,prompt, Methods / Risk of bias in individual studies: Describe methods used for assessing ,51.81818181818182
126,PRISMA,Protocol and registration: The report should include information about the registration number of the review in a registry for systematic reviews.,fulltext,Protocol and registration Preferred Reporting Items for Systematic Reviews and Meta-Analyses (PRISMA) was used in the formulation of the systematic review and meta-analysis. 8 The study was not registered with PROSPERO (International Prospective Register of Systematic Reviews),79.45205479452055
126,PRISMA,Discussion: The discussion should include a discussion of the implications of the findings for future research.,prompt," Discussion / Conclusions: Provide a general interpretation of the results in the context of other evidence, and implications for future research.",71.17117117117118
126,PRISMA,"Abstract: The abstract should include the following elements: Background, Objectives, Methods, Results, and Conclusions.",prompt,"Abstract / Structured summary: Provide a structured summary including, as applicable: background; objectives; data sources; study eligibility criteria, participants, and interventions; study appraisal and synthesis methods; results; limitations; conclusions ",78.33333333333333
126,PRISMA,"Methods: The methods should include an explicit description of the following: eligibility criteria, information sources, search strategy, study selection, data collection process, data items, risk of bias in individual studies, summary measures, synthesis of results, and risk of bias across studies.",prompt,/ Risk of bias in individual studies: Describe methods used for assessing risk of bias of individual studies ,26.0
126,PRISMA,Protocol and registration: The report should include information about whether a review protocol exists and where it can be accessed.,prompt,"Protocol and registration: Indicate if a review protocol exists, if and where it can be accessed ",66.9172932330827
126,PRISMA,"Results: The results should include a description of the following: study selection, study characteristics, risk of bias within studies, risk of bias across studies, results of individual studies, synthesis of results, and additional analyses.",prompt,"results: Present results of each meta-analysis done, including confidence intervals and measures of consistency. P22. Results / Risk of bias across studies: Present results of any assessment of risk of bias across studies (see Item P15). P23. Results / Additional analysis: Give results of additional analyses,",65.84362139917695
126,PRISMA,Protocol and registration: The report should include information about the reporting of harms.,fulltext,Protocol and registration Preferred Report,41.48936170212766
126,PRISMA,Protocol and registration: The report should include information about the reporting of adverse events.,fulltext,Protocol and registration Preferred Report,37.86407766990292
126,PRISMA,Title: The title of the report should include the words 'systematic review' or 'meta-analysis'.,fulltext, of the selection process for studies included in the systematic review and meta-analysis. ,68.42105263157895
126,PRISMA,Protocol and registration: The report should include information about any amendments to the protocol.,fulltext,Protocol and registration Preferred Report,37.254901960784316
126,PRISMA,"Registration and protocol: The report should include information about whether a review protocol exists, where it can be accessed, and any amendments to the protocol.",prompt," Protocol and registration: Indicate if a review protocol exists, if and where it can be accessed (",46.3855421686747
126,PRISMA,"Discussion: The discussion should include a summary of the evidence, a discussion of the strengths and limitations of the review, a discussion of the implications of the findings, and a discussion of the limitations of the evidence.",prompt,"ssion [see Item P16]). P24. Discussion / Summary of evidence: Summarize the main findings including the strength of evidence for each main outcome; consider their relevance to key groups (e.g., healthcare providers, users, and policy makers). P25. Discussion / Limitations: ",58.62068965517242
126,PRISMA,Methods: The methods should include a description of the methods used for assessing the quality of individual studies.,prompt, Methods / Risk of bias in individual studies: Describe methods used for assessing risk of bias of individual studies ,69.4915254237288
126,PRISMA,"Methods: The methods should include a description of the effect measures (for example, odds ratio, risk ratio, hazard ratio, or standardized mean difference) and the statistical methods used to combine the results of studies.",prompt,"Methods / Summary measures: State the principal summary measures (e.g., risk ratio, difference in means). P14. Methods / Synthesis of results: Describe the methods of handling data and combining results of studies,",51.55555555555556
126,PRISMA,Results: The results should include a description of the results of any assessments of risk of bias that were conducted in individual studies and any assessments of risk of bias that were conducted across studies.,prompt,"results: Present results of each meta-analysis done, including confidence intervals and measures of consistency. P22. Results / Risk of bias across studies: Present results of any assessment of risk of bias across studies ",60.093896713615024
126,PRISMA,Results: The results should include a description of the results of any assessments of the quality of individual studies.,prompt, Describe methods used for assessing risk of bias of individual studies ,43.80165289256198
126,PRISMA,Funding: The report should include information about the sources of funding for the systematic review and/or individual studies.,prompt,Funding: Describe sources of funding for the systematic review and o,52.34375
126,PRISMA,Protocol and registration: The report should include information about the reporting of serious adverse events.,fulltext,Protocol and registration Preferred Report,35.13513513513513
126,PRISMA,Protocol and registration: The report should include information about the reporting of serious adverse reactions.,fulltext,Protocol and registration Preferred Report,34.210526315789465
126,PRISMA,Conflicts of interest: The report should include information about any conflicts of interest that threaten the validity of the review.,prompt,conflict of interest included? Potential sources of support should be clearly acknowledged in both the systematic review ,52.98507462686567
126,PRISMA,Protocol and registration: The report should include information about the reporting of suspected unexpected serious adverse reactions.,fulltext,Protocol and registration Preferred Report,30.37037037037037
126,PRISMA,Discussion: The discussion should include a discussion of the limitations of the evidence.,prompt," Discussion / Conclusions: Provide a general interpretation of the results in the context of other evidence,",67.77777777777779
126,PRISMA,Discussion: The discussion should include a discussion of any potential sources of heterogeneity and inconsistency in the results.,prompt, included? Potential sources of ,24.615384615384617
126,PRISMA,Discussion: The discussion should include a discussion of the implications of the findings for practice and policy makers.,prompt,nclusions and implications of key findings; systematic,36.885245901639344
129,AMSTAR,"The review included a comprehensive search strategy, with no language or date restrictions.",prompt, a comprehensive literature search per,31.868131868131865
129,PRISMA,"The review included a comprehensive search strategy, with no language or date restrictions.",prompt, a comprehensive literature search per,31.868131868131865
130,AMSTAR,A list of studies (included and excluded) was supplied.,prompt,a list of studies (included and excluded) ,76.36363636363637
130,AMSTAR,Study characteristics and quality were used to assess possible small-study effects.,fulltext,raction and quality assess,28.915662650602414
130,AMSTAR,The methods for combining study data were justified.,prompt,the methods of handling data and combining ,53.84615384615385
130,AMSTAR,The characteristics of the included studies were reported.,prompt,the characteristics of the included studies ,75.86206896551724
130,AMSTAR,The scientific quality of the included studies was used to assess possible publication bias.,prompt,the scientific quality of the included studies assessed ,59.78260869565217
130,AMSTAR,The characteristics of the included studies were used to assess possible publication bias.,prompt,the characteristics of the included studies ,48.88888888888889
130,AMSTAR,The scientific quality of the included studies was assessed and documented.,prompt,the scientific quality of the included studies assessed and documented?,94.66666666666667
130,AMSTAR,The likelihood of publication bias was examined.,prompt,the likelihood of publication bias assessed?,85.41666666666666
130,AMSTAR,The review methods were established prior to the conduct of the review and described in the published review.,prompt,"e established before the conduct of the review. Note: Need to refer to a protocol, ethics approval, or pre-determined/a priori published re",61.46788990825688
130,AMSTAR,The methods used for combining study data were described.,prompt,the methods used to combine the findings of stud,57.89473684210527
130,AMSTAR,The presence and impact of heterogeneity was assessed.,prompt,cannot pool because of heterogeneity/va,46.29629629629629
130,PRISMA,"Methods: Describe the methods for assessing risk of bias in individual studies (including selection, performance, detection, attrition, and reporting bias) if appropriate.",prompt,es: Describe methods used for assessing risk of bias of individual studies (including specification o,53.80116959064327
130,PRISMA,Discussion: Describe the limitations of the review.,prompt,ationale: Describe the rationale for the review ,72.54901960784314
130,PRISMA,Data collection process: Describe the methods used for data extraction and quality assessment in sufficient detail to allow replication.,prompt,Data collection process: Describe method of data extraction ,43.38235294117647
130,PRISMA,Methods: Describe the methods used for data synthesis.,prompt,Methods / Synthesis of results: Describe the methods of handling data a,68.5185185185185
130,PRISMA,"Results: Summarize the evidence (e.g., meta-analysis, GRADE) if appropriate.",prompt,"ency (e.g., I2) for each meta-analysis. ",35.526315789473685
130,PRISMA,"Methods: Describe any methods used to examine the potential for small-study effects (e.g., publication bias).",prompt,"y affect the cumulative evidence (e.g., publication bias, ",39.449541284403665
130,PRISMA,Discussion: Report any potential sources of conflict of interest.,prompt, conflict of interest ,33.84615384615385
130,PRISMA,"Methods: Provide an explicit description of the review methods (e.g., search strategy, inclusion and exclusion criteria, study selection, data extraction, and quality assessment).",prompt, provided? The research question and inclusion criteria ,28.49162011173184
130,PRISMA,"Abstract: Provide a structured summary including, as applicable: background, objectives, data sources, study eligibility criteria, participants, study design, setting, methods, main results, and conclusions.",prompt,"Abstract / Structured summary: Provide a structured summary including, as applicable: background; objectives; data sources; study eligibility criteria, participants, and interventions; study appraisal and synthesis methods; results; limitations; conclusions ",92.27053140096618
130,PRISMA,Discussion: Discuss the results in the context of other published literature.,prompt,Discussion / Conclusions: Provide a general interpretation of the results in the context of other ,68.83116883116884
130,PRISMA,"Study selection: Describe the process of study selection (e.g., screening, eligibility, and inclusion criteria).",prompt,"Study selection: State the process for selecting studies (i.e., screening, eligibility, inclu",68.75
130,PRISMA,Title: Use a title that accurately and concisely describes the review.,fulltext," and DA conceptualized and designed the study, critically review",44.285714285714285
130,PRISMA,"Title: Identify the report as a systematic review, meta-analysis, or review.",prompt,"Title: Identify the report as a systematic review, meta-analysis, or ",90.78947368421053
130,PRISMA,Results: Present results of the individual studies.,prompt,Results / Results of individual studies:,78.43137254901961
130,PRISMA,Discussion: Discuss the implications of the findings and their potential importance.,prompt,conclusions and implications of key findings;,42.85714285714286
130,PRISMA,Abstract: Include the structured summary in all databases and indexing services.,prompt,Abstract / Structured summary: Provide a structured summary includ,52.5
130,PRISMA,Funding: Report the source of funding for the review and any other competing interests.,prompt,Funding: Describe sources of funding for the systematic review and other supp,65.51724137931035
130,PRISMA,"Information sources: Describe all information sources (e.g., databases with dates of coverage, websites, contact with study authors, organizational archives).",prompt,"Information sources: Describe all information sources (e.g., databases with dates of coverage, contact with study authors to identify additional studies) in the search",87.34177215189874
130,PRISMA,Methods: Specify the characteristics of studies considered for the review.,prompt," characteristics (e.g., years considered,",43.24324324324324
130,PRISMA,"Methods: Describe the methods for combining data and for assessing the quality of evidence (e.g., GRADE) if appropriate.",prompt,Methods / Synthesis of results: Describe the methods of handling data and combining results of stud,50.0
