publication_id,tool,quote,best_match_source,best_match,similarity
70,PRISMA,"Abstract & Introduction: The laparoscopic treatment of pediatric populations remains controversial. This review was conducted to compare the clinical and cost effectiveness of laparoscopic and open surgical approaches for a variety of surgical indications in pediatric populations. Method/ Design: A computerized comprehensive search supplemented by a manual review of the literature was performed for all peer-reviewed publications comparing laparo-scopic and open appendectomy, fundoplication and hernia repair cohorts. Outcomes of interest were length of stay (LOS), operating room (OR) time, complication rates and total hospital costs; aggregation of outcome rates was performed with the Mantel-Haenszel method. Results: A total of 24 articles were identified that met the search and inclusion criteria. LOS was found to be signifi-cantly reduced in favor of the laparoscopic approach, with a weighted mean difference of − 1.44 days, although the OR time was signifi-cantly increased, with a weighted mean difference of + 12.8 min. Laparoscopic intervention was associated with a significantly reduced complication rate compared to the open approach (10.6 vs. 15.6 % ). Total hospital costs of the laparoscopic approaches were found to be insignifi-cantly increased compared to the open techniques. Conclusion: This review further supports the use of minimally invasive surgery (MIS) in pediatric populations, demonstrating that the three types laparoscopic procedures reviewed resulted in better patient outcomes compared to open procedures, in the form of reduced LOS and over-all complication rates. Increased utilization of this approach may prove benefi-cial to pediatric patients.",fulltext,"Abstract & Introduction: The laparoscopic treatment of pediatric populations remains controversial. This review was conducted to compare the clinical and cost effectiveness of laparoscopic and open surgical approaches for a variety of surgical indications in pediatric populations. Method/ Design: A computerized comprehensive search supplemented by a manual review of the literature was performed for all peer-reviewed publications comparing laparoscopic and open appendectomy, fundoplication and hernia repair cohorts. Outcomes of interest were length of stay (LOS), operating room (OR) time, complication rates and total hospital costs; aggregation of outcome rates was performed with the Mantel-Haenszel method. Results: A total of 24 articles were identified that met the search and inclusion criteria. LOS was found to be signifi cantly reduced in favor of the laparoscopic approach, with a weighted mean difference of − 1.44 days, although the OR time was signifi cantly increased, with a weighted mean difference of + 12.8 min. Laparoscopic intervention was associated with a significantly reduced complication rate compared to the open approach (10.6 vs. 15.6 % ). Total hospital costs of the laparoscopic approaches were found to be insignifi cantly increased compared to the open techniques. Conclusion: This review further supports the use of minimally invasive surgery (MIS) in pediatric populations, demonstrating that the three types laparoscopic procedures reviewed resulted in better patient outcomes compared to open procedures, in the form of reduced LOS and overall complication rates. Increased utilization of this approach may prove benefi cial to pediatric patients.",99.88172678888232
70,PRISMA,"Methods / Information sources: All available electronic databases including the Brit-ish Nursing Index (BNI), Cumulative Index to Nursing and Allied Health Literature (CINAHL), Cochrane Library, EMBASE (Excerpta Medica), Intute: Health & Life Sciences, MEDLINE, PubMed, BIO-SIS Previews, ISI Web of Knowledge, ISI Web of Science and Igen-taConnect, were systematically searched for each procedure, between the period 1992 – 2009 for all English and non– English language articles.",fulltext,"cted. All available electronic databases including the British Nursing Index (BNI), Cumulative Index to Nursing and Allied Health Literature (CINAHL), Cochrane Library, EMBASE (Excerpta Medica), Intute: Health & Life Sciences, MEDLINE, PubMed, BIOSIS Previews, ISI Web of Knowledge, ISI Web of Science and IgentaConnect, were systematically searched for each procedure, between the period 1992 – 2009 for all English and non– English language articles.",93.75
70,PRISMA,"Methods / Eligibility criteria: The review focused on three specific procedures for which outcome data exists: Laparoscopic appendectomy, Laparoscopic fundoplication (anti-reflux procedure) and Laparoscopic inguinal hernia repair. A comprehensive literature review was conducted, and all available electronic databases including the Brit-ish Nursing Index (BNI), Cumulative Index to Nursing and Allied Health Literature (CINAHL), Cochrane Library, EMBASE (Excerpta Medica), Intute: Health & Life Sciences, MEDLINE, PubMed, BIO-SIS Previews, ISI Web of Knowledge, ISI Web of Science and Igen-taConnect, were systematically searched for each procedure, between the period 1992 – 2009 for all English and non– English language articles.",fulltext,"ctice, this review focused on three specific procedures for which outcome data exists: ▶ Laparoscopic appendectomy, ▶ Laparoscopic fundoplication (anti-reflux procedure) and ▶ Laparoscopic inguinal hernia repair. Search strategy To complete this study a comprehensive literature review was conducted. All available electronic databases including the British Nursing Index (BNI), Cumulative Index to Nursing and Allied Health Literature (CINAHL), Cochrane Library, EMBASE (Excerpta Medica), Intute: Health & Life Sciences, MEDLINE, PubMed, BIOSIS Previews, ISI Web of Knowledge, ISI Web of Science and IgentaConnect, were systematically searched for each procedure, between the period 1992 – 2009 for all English and non– English language articles.",95.36152796725784
70,PRISMA,Methods / Summary measures: Not applicable as this is a systematic review without a meta-analysis.,prompt," not applicable (for example, items P14, P15, P16, P21, P22, P23 in the context of a systematic review without a meta-analysis)",68.36734693877551
70,PRISMA,Methods / Risk of bias in individual studies: Not applicable as this is a systematic review without a meta-analysis.,prompt," not applicable (for example, items P14, P15, P16, P21, P22, P23 in the context of a systematic review without a meta-analysis)",58.62068965517242
70,PRISMA,Methods / Data items: Not applicable as this is a systematic review without a meta-analysis.,prompt," not applicable (for example, items P14, P15, P16, P21, P22, P23 in the context of a systematic review without a meta-analysis)",72.82608695652173
70,PRISMA,Results / Study selection: A total of 24 articles were identified that met the search and inclusion criteria. These articles were included in the systematic review.,fulltext,"Results & A total of 24 articles were identified that met the search and inclusion criteria. 16 appendectomy, 4 fundoplication and 4 inguinal hernia studies comparing procedural outcomes method were included.",75.0
70,PRISMA,Results / Risk of bias within studies: Not applicable as this is a systematic review without a meta-analysis.,prompt," not applicable (for example, items P14, P15, P16, P21, P22, P23 in the context of a systematic review without a meta-analysis)",61.46788990825688
70,PRISMA,"Methods / Design: A computerized comprehensive search supplemented by a manual review of the literature was performed for all peer-reviewed publications comparing laparo-scopic and open appendectomy, fundoplication and hernia repair cohorts.",fulltext,"Method/ Design: A computerized comprehensive search supplemented by a manual review of the literature was performed for all peer-reviewed publications comparing laparoscopic and open appendectomy, fundoplication and hernia repair cohorts.",98.7551867219917
70,PRISMA,"Discussion / Conclusions: This review strengthens the use of MIS in pediatric populations, demonstrating that the three laparoscopic procedures reviewed showed better patient outcomes compared to open procedures in the form of reduced LOS and complication rates. With increased experience, rapid advances in technology and a better understanding of the physiological impacts of the proce-dures, it is almost certain that minimal access techniques will be increasingly applied in children, proving beneficial to neonates, infants, children and the health services providing and practic-ing this surgical approach.",fulltext,"ng. This review strengthens the use of MIS in pediatric populations, demonstrating that the three laparoscopic procedures reviewed showed better patient outcomes compared to open procedures in the form of reduced LOS and complication rates. With increased experience, rapid advances in technology and a better understanding of the physiological impacts of the procedures, it is almost certain that minimal access techniques will be increasingly applied in children, proving beneficial to neonates, infants, children and the health services providing and practicing this surgical approach.",95.91503267973856
70,PRISMA,Results / Study characteristics: Not applicable as this is a systematic review without a meta-analysis.,prompt," not applicable (for example, items P14, P15, P16, P21, P22, P23 in the context of a systematic review without a meta-analysis)",65.04854368932038
70,PRISMA,"Discussion / Limitations: The validity of the results of this review largely depends on the validity of the included studies. Many of the included studies failed to take all the steps necessary to avoid bias. There may well be an inherent bias in the analyses, which are likely to favor the ‘newer’ MIS/laparoscopic technique. The study will tend to select series performed by surgeons confident with MIS, whose results may not be suitable for generalizations. Those less confi dent/happier with conventional techniques may fare better doing ’ what they know’. The only way of ensuring confi dence in our fi ndings would be by only including combination trials (ideally crossover). Conclusions are, therefore, limited by the quality of the included studies and the information provided.",fulltext," limitations & The validity of the results of this review largely depends on the validity of the included studies. Many of the included studies failed to take all the steps necessary to avoid bias. There may well be an inherent bias in the analyses, which are likely to favor the ‘newer’ MIS/laparoscopic technique. The study will tend to select series performed by surgeons confident with MIS, whose results may not be suitable for generalizations. Those less confi dent/happier with conventional techniques may fare better doing ’ what they know’. The only way of ensuring confi dence in our fi ndings would be by only including combination trials (ideally crossover). Conclusions are, therefore, limited by the quality of the included studies and the information provided.",98.47328244274809
70,PRISMA,Methods / Risk of bias across studies: Not applicable as this is a systematic review without a meta-analysis.,prompt," not applicable (for example, items P14, P15, P16, P21, P22, P23 in the context of a systematic review without a meta-analysis)",61.46788990825688
70,PRISMA,Methods / Search: The titles and / or abstracts of all identified studies were reviewed and full manuscripts obtained for those that appeared potentially relevant.,fulltext, search. The titles and / or abstracts of all identified studies were reviewed and full manuscripts obtained for those that appeared potentially relevant.,94.47852760736197
70,PRISMA,Methods / Study selection: A total of 24 articles were identified that met the search and inclusion criteria. These articles were included in the systematic review.,fulltext,method. Results: A total of 24 articles were identified that met the search and inclusion criteria. LOS w,61.58536585365854
70,PRISMA,Results / Results of individual studies: Not applicable as this is a systematic review without a meta-analysis.,prompt," not applicable (for example, items P14, P15, P16, P21, P22, P23 in the context of a systematic review without a meta-analysis)",61.261261261261254
70,PRISMA,Results / Synthesis of results: Not applicable as this is a systematic review without a meta-analysis.,prompt, synthesis (A9) or assessing publication bias (A11) in the context of a systematic review without a meta-analysis),73.52941176470588
70,PRISMA,"Discussion / Summary of evidence: This review further supports the use of minimally invasive surgery (MIS) in pediatric populations, demonstrating that the three types laparoscopic procedures reviewed resulted in better patient outcomes compared to open procedures, in the form of reduced LOS and over-all complication rates. Increased utilization of this approach may prove benefi-cial to pediatric patients.",fulltext,"nclusion: This review further supports the use of minimally invasive surgery (MIS) in pediatric populations, demonstrating that the three types laparoscopic procedures reviewed resulted in better patient outcomes compared to open procedures, in the form of reduced LOS and overall complication rates. Increased utilization of this approach may prove benefi cial to pediatric patients.",93.39853300733496
71,AMSTAR,The review methods were appropriate to the review question.,fulltext,"this review, were rep",30.508474576271183
71,AMSTAR,The review methods were established prior to the conduct of the review and were specified in the review protocol.,prompt,"e established before the conduct of the review. Note: Need to refer to a protocol,",57.52212389380531
71,AMSTAR,The data extraction process was appropriate.,prompt," data extraction, consensus process ",61.36363636363637
71,AMSTAR,The methods for quantitative synthesis were appropriate.,prompt, quantitative synthesis ,42.85714285714286
71,AMSTAR,The search strategy was appropriate for the review question.,prompt,the search strategy ,33.333333333333336
71,AMSTAR,The methods for statistical combination of results were appropriate.,prompt,the methods used to combine the findings of studies appropriate?,64.70588235294117
71,AMSTAR,The assessment of risk of bias was appropriate for the review question.,prompt, assessment of risk of bias ,39.43661971830986
71,AMSTAR,The inclusion criteria for the review were appropriate for the review question.,prompt,nd inclusion criteria should be established before the conduct of the review.,60.75949367088608
71,AMSTAR,The selection process for studies was appropriate.,prompt, selection: State the process for selecting studies ,62.0
71,AMSTAR,The methods for assessing publication bias were appropriate.,prompt,or assessing publication bias ,50.0
71,AMSTAR,The methods for assessing heterogeneity were appropriate.,fulltext, method (21). The effect of heterogeneity w,45.614035087719294
71,PRISMA,The results of any sensitivity analyses were reported.,prompt,"e results of additional analyses, if done (e.g., sensitivity or subgroup analyses, meta-re",77.77777777777779
71,PRISMA,The review was updated.,prompt,"the review, with reas",60.86956521739131
71,PRISMA,The search strategy for identification of studies was described in enough detail to allow replication.,fulltext, Search strategy for ind,23.529411764705888
71,PRISMA,The methods for combining studies were described in detail.,prompt,"the methods of handling data and combining results of studies,",57.6271186440678
71,PRISMA,The assessment of risk of bias was conducted in duplicate and described in detail.,fulltext,t ways and expressed complications as a count of events or described ,45.12195121951219
71,PRISMA,The results of any publication bias assessments were reported.,prompt,f publication bias assessed? An assessment,50.0
71,PRISMA,The review was not published in a journal that adheres to the International Committee of Medical Journal Editors' Uniform Requirements for Manuscripts Submitted to Biomedical Journals.,prompt,"the review, with reason",11.956521739130432
71,PRISMA,The review was reported according to the PRISMA statement.,prompt, review with the AMSTAR tool and its reporting quality with the PRISMA t,62.06896551724138
71,PRISMA,"The review question and inclusion criteria were specified in the protocol, including the study characteristics (e.g. PICOS, participants, interventions, comparators, outcomes, and study design) and the types of study to be included.",prompt,"ce to participants, interventions, comparisons, outcomes, and study design (",31.465517241379317
71,PRISMA,The protocol was established before the review began and was appropriate for the review question.,prompt, established before the conduct of the review.,42.26804123711341
71,PRISMA,"The list of studies (including incomplete studies) included in the review, the reasons for excluding the ineligible studies, and the full electronic search strategy were reported in sufficient detail to allow replication.",prompt,"s of studies screened, assessed for eligibility, and included in the review, with reasons for exclusi",31.221719457013574
71,PRISMA,The protocol was published before the review began.,prompt,blished before the conduct of the review.,50.98039215686274
71,PRISMA,The risk of bias in individual studies was assessed and described in detail.,prompt, Risk of bias in individual studies: Describe,59.210526315789465
71,PRISMA,The conclusions were based on the totality of the available evidence and were presented in the context of the study designs included in the review.,fulltext,e programme. The remainder of the studies included in this systematic review ,38.775510204081634
71,PRISMA,The results of statistical tests of heterogeneity were reported.,prompt,cause of heterogeneity/var,34.375
71,PRISMA,The data extraction was performed in duplicate and described in detail.,prompt," data extraction from reports (e.g., piloted forms, independently, in duplicate) and any processes for obtai",74.64788732394366
71,PRISMA,The study selection was performed in duplicate and described in detail.,fulltext, was performed to examine ad,30.98591549295775
71,PRISMA,The conclusions were linked to the quality of the evidence.,prompt," Conclusions: Provide a general interpretation of the results in the context of other evidence,",81.35593220338984
71,PRISMA,The limitations of the review were discussed.,prompt,"the conclusions of the review,",53.333333333333336
71,PRISMA,The review was not published in a peer-reviewed journal.,fulltext, review of published data. The re,46.42857142857143
71,PRISMA,The results of the search were reported in sufficient detail to allow replication.,prompt,The results of the methodological rigor and scient,42.6829268292683
71,PRISMA,The review was peer reviewed.,fulltext, review. obesity review,58.62068965517242
71,PRISMA,The review was registered in a suitable registry.,prompt,"the review, and explicitly stated in ",48.97959183673469
71,PRISMA,The review methods were described in sufficient detail to allow replication by others.,prompt,re described as above. A7. Was the scient,30.23255813953488
71,PRISMA,The results of any subgroup analyses were reported.,prompt,"e results of additional analyses, if done (e.g., sensitivity or subgroup analyses, meta-re",76.47058823529412
71,PRISMA,"The results of meta-analyses, including the forest plots, were reported.",prompt," results of each meta-analysis done, including ",50.0
71,PRISMA,Study characteristics were described in the results of the review.,prompt,"study, present characteristics for which data were extracted ",53.03030303030303
73,AMSTAR,"Detailed tables regarding level of evidence of studies included in review, results of penile straightening procedures and urethroplasty techniques, and some key points for followup are available at <http://robertdebreparis.aphp.fr/fr/profsante_recherche_page.php?repertoire  profsante&page  recherche&doss_type_id  31&doss_id  224>.",fulltext,"Detailed tables regarding level of evidence of studies included in review, results of penile straightening procedures and urethroplasty techniques, and some key points for followup are available at http:// robertdebreparis.aphp.fr/fr/profsante_recherche_page. php?repertoire  profsante&page  recherche& doss_type_id  31&doss_id  224. ",99.70238095238095
73,AMSTAR,The search yielded 69 pertinent studies. These studies were generally of low quality (69.5% surgical series).,fulltext,The search yielded 69 pertinent studies. These studies were generally of low quality (69.5% surgical series).,100.0
73,AMSTAR,The authors declare no conflict of interest.,prompt, conflict of interest ,50.0
73,AMSTAR,"We reviewed studies published between 1990 and December 2009, searching for 'hypospadias' in MEDLINE®/PubMed®, EMBASE®, Web of Science® and the Cochrane Library.",fulltext,"We reviewed studies published between 1990 and December 2009, searching for “hypospadias” in MEDLINE®/PubMed®, EMBASE®, Web of Science® and the Cochrane Library.",100.0
73,AMSTAR,We included in this review only series containing detailed results after primary repair of severe hypospadias or after curvature correction in patients with primary severe hypospadias. Duplicated publications and congress abstracts were excluded.,fulltext,We included in this review only series containing detailed results after primary repair of severe hypospadias or after curvature correction in patients with primary severe hypospadias. Duplicated publications and congress abstracts were excluded.,100.0
73,AMSTAR,"We included in this review only series containing detailed results after primary repair of severe hypospadias or after curvature correction in patients with primary severe hypospadias. Duplicated publications and congress abstracts were excluded. Selected articles were distinguished according to level of evidence, and their quality was assessed.",fulltext,"We included in this review only series containing detailed results after primary repair of severe hypospadias or after curvature correction in patients with primary severe hypospadias. Duplicated publications and congress abstracts were excluded. Selected articles were distinguished according to level of evidence, 8 and their quality was assessed.",100.0
73,AMSTAR,The present systematic review shows the weak evidence backing current management of primary severe hypospadias.,fulltext,The present systematic review shows the weak evidence backing current management of primary severe hypospadias.,100.0
73,AMSTAR,Three doctors reviewed the abstracts. Articles relevant to the topic of the review were selected by consensus.,fulltext,Three doctors reviewed the abstracts. Articles relevant to the topic of the review were selected by consensu,98.18181818181819
73,AMSTAR,"Given the low quality and limited validity of the studies available, we did not attempt any meta-analysis.",fulltext,"Given the low quality and limited validity of the studies available, we did not attempt any meta-analysis.",100.0
73,PRISMA,"Selected articles were distinguished according to level of evidence, and their quality was assessed.",fulltext,"Selected articles were distinguished according to level of evidence, 8 and their quality was assessed.",100.0
73,PRISMA,The search yielded 69 pertinent studies. These studies were generally of low quality (69.5% surgical series).,fulltext,The search yielded 69 pertinent studies. These studies were generally of low quality (69.5% surgical series).,100.0
73,PRISMA,The ideal surgical management of primary severe hypospadias (proximal hypospadias with severe ventral curvature) remains controversial. Major trends in management have significantly changed during the last few decades.,fulltext,THE ideal surgical management of primary severe hypospadias (proximal hypospadias with severe ventral curvature) remains controversial. Major trends in management have significantly changed during the last few decades.,100.0
73,PRISMA,The authors declare no conflict of interest.,prompt, conflict of interest ,50.0
73,PRISMA,"The present systematic review shows the weak evidence backing current management of primary severe hypospadias. We even lack a clear-cut definition of severe hypospadias and associated curvature. Hence, while we developed general recommendations for treatment based on our review of available evidence, we emphasize the need to establish shared criteria for accurate preoperative or introperative patient stratification, and to define objective out- come measures and followup intervals for data reporting to make comparison of surgical approaches reliable.",fulltext,"The present systematic review shows the weak evidence backing current management of primary severe hypospadias. We even lack a clear-cut definition of severe hypospadias and associated curvature. Hence, while we developed general recommendations for treatment based on our review of available evidence, we emphasize the need to establish shared criteria for accurate preoperative or introperative patient stratification, and to define objective outcome measures and followup intervals for data reporting to make comparison of surgical approaches reliable.",99.64093357271095
73,PRISMA,"We reviewed studies published between 1990 and December 2009, searching for 'hypospadias' in MEDLINE®/PubMed®, EMBASE®, Web of Science® and the Cochrane Library.",fulltext,"We reviewed studies published between 1990 and December 2009, searching for “hypospadias” in MEDLINE®/PubMed®, EMBASE®, Web of Science® and the Cochrane Library.",100.0
